,chemical_name,smiles,database_id,cas,odor_data,odor_labels_filtered,labels_trainAndtest,labels_cv0,labels_cv1,labels_cv2,labels_cv3,labels_cv4
1668,Methylbutyl hexanoate,CCCCCC(=O)OCC(C)CC,1864,2601-13-0,"Fruity, apple-banana-pineapple aroma & taste","['fruity', 'apple', 'pineapple', 'banana']",1.0,0.0,1.0,1.0,1.0,1.0
449,Decanal,CCCCCCCCCC=O,515,112-31-2,"Strong, penetrating, sweet, waxy, orange peel odor; citrus taste","['waxy', 'sweet', 'orange']",0.0,-1.0,-1.0,-1.0,-1.0,-1.0
678,Dipropyl trisulfide,CCCSSSCCC,764,6028-61-1,"Strong, green onion-like, durian odor and taste","['green', 'onion']",1.0,1.0,1.0,1.0,0.0,1.0
338,Carvacryl ethyl ether,CCOc1cc(C(C)C)ccc1C,390,4732-13-2,"Spicy, earthy, herbaceous odor reminding of carrot seed; spicy taste","['spicy', 'earthy', 'herbal']",1.0,1.0,1.0,0.0,1.0,1.0
918,Fenchyl acetate,CC(=O)OC1C(C)(C)[C@@H]2CC[C@@]1(C)C2,1021,13851-11-1,Sweet fir needle like odor; pine needle herbaceous taste,['sweet'],1.0,1.0,1.0,1.0,1.0,0.0
2655,Acetaldehyde dibenzyl acetal,CC(OCc1ccccc1)OCc1ccccc1,3035,23556-90-3,"Mild, sweet, slightly green-fruity odor.","['green', 'fruity', 'sweet']",1.0,1.0,0.0,1.0,1.0,1.0
452,Decanol,CCCCCCCC(O)CC,518,1565-81-7,"Oily-fatty-waxy, orange, mushroom, musty odor","['oily', 'fatty', 'waxy', 'orange', 'musty', 'mushroom']",0.0,-1.0,-1.0,-1.0,-1.0,-1.0
1953,Nonenone,C/C=C/C(=O)CCCCC,2181,32064-72-5,"Sweet, earthy, mushroom, fruity","['earthy', 'fruity', 'sweet', 'mushroom']",1.0,0.0,1.0,1.0,1.0,1.0
3220,Isovaleraldehyde dihexyl acetal,CCCCCCOC(CC(C)C)OCCCCCC,3744,,"Green, somewhat alcoholic, malty-cocoa, fermented","['alcoholic', 'malty', 'green', 'cocoa', 'fermented']",1.0,0.0,1.0,1.0,1.0,1.0
2581,Heptanethiol ,CCCCCC(C)S,2942,628-00-2,"Sulfury, onion-like, savoury, fatty, vegetable-like, bell pepper","['vegetable', 'fatty', 'savory', 'onion', 'sulfurous']",1.0,0.0,1.0,1.0,1.0,1.0
2626,Triethyltrithiane,CCC1CSSSC1(CC)CC,2997,53897-58-5,"Green, allium (onion, garden cress), savory","['green', 'alliaceous', 'savory', 'onion']",1.0,1.0,1.0,1.0,0.0,1.0
2231,Propyl hydroxybenzoate,CCCOC(=O)c1ccc(O)cc1,2490,94-13-3,Almost odorless and tasteless; antimicrobial preservative,['odorless'],1.0,1.0,0.0,1.0,1.0,1.0
450,Decanoic acid,CCCCCCCCCC(=O)O,516,334-48-5,"Fatty-waxy, cheesy dairy odor and taste","['fatty', 'waxy', 'dairy', 'cheesy']",1.0,0.0,1.0,1.0,1.0,1.0
2140,Phenylpropionaldehyde dimethyl acetal,COC(OC)C(C)c1ccccc1,2389,90-87-9,"Green, mushroom, floral-citrus odor; fruity, floral, green, walnut taste","['green', 'floral', 'mushroom', 'citrus']",1.0,1.0,1.0,0.0,1.0,1.0
174,Benzothiazole,c1ccc2scnc2c1,205,95-16-9,"Burnt, Sulfuraceous, vegetative, cooked, beefy and coffee-like","['vegetable', 'burnt', 'coffee', 'sulfurous', 'beefy']",1.0,1.0,1.0,1.0,1.0,0.0
2310,Succinic acid,O=C(O)CCC(=O)O,2604,110-15-6,"Odorless, sour acid taste; flavor, umami & saltiness enhancer",['odorless'],1.0,1.0,0.0,1.0,1.0,1.0
1339,Isopropyl dodecanoate,CCCCCCCCCCCC(=O)OC(C)C,1491,10233-13-3,"Waxy-fatty-oily, slightly green floral with cream, dairy & fruity notes","['creamy', 'green', 'oily', 'fatty', 'fruity', 'waxy', 'dairy', 'floral']",0.0,-1.0,-1.0,-1.0,-1.0,-1.0
3033,Propylene glycol dibutyrate,CCCC(=O)OCC(C)OC(=O)CCC,3493,50980-84-2,"Mild, weak fruity flavor",['fruity'],1.0,1.0,1.0,1.0,1.0,0.0
2376,Tolualdehyde,Cc1ccc(C=O)cc1,2682,104-87-0,Sweet bitter almond & cherry-like,"['cherry', 'almond', 'sweet']",1.0,1.0,1.0,0.0,1.0,1.0
2901,Hexenyl benzoate,CCCCC=COC(=O)c1ccccc1,3341,,"Mild, green-herbaceous, woody balsamic odor","['green', 'woody', 'balsamic', 'herbal']",1.0,1.0,0.0,1.0,1.0,1.0
2446,Undecalactone,CCCCCCC[C@H]1CCC(=O)O1,2761,104-67-6,"Strong fatty, peach-apricot odor; peach taste in dilution","['fatty', 'peach', 'apricot']",1.0,0.0,1.0,1.0,1.0,1.0
282,Butyl laurate,CCCCCCCCCCCC(=O)OCCCC,318,106-18-3,"Mild, fatty-oily, peanut oil-like, somewhat weak fruity odor","['oily', 'fatty', 'fruity']",1.0,1.0,1.0,1.0,0.0,1.0
2988,Methylbutyl cinnamate,CCC(C)COC(=O)/C=C/c1ccccc1,3439,4654-29-9,"Sweet, floral, balsamic, fruity-berry cocoa-like odor and taste","['fruity', 'cocoa', 'berry', 'balsamic', 'floral', 'sweet']",1.0,0.0,1.0,1.0,1.0,1.0
3442,Diisoamyl trisulfide,CC(C)CCSSSCCC(C)C,4126,955371-64-9,Cooked onion garlic notes,"['onion', 'garlic']",1.0,1.0,0.0,1.0,1.0,1.0
1669,Methylbutyl isobutyrate,CCC(C)COC(=O)C(C)C,1865,2445-69-4,Strong mixed fruity odor; sweet mixed fruity taste,['fruity'],1.0,1.0,1.0,0.0,1.0,1.0
3176,Ethoxybenzyl alcohol,CCOc1ccc(CO)cc1,3685,6214-44-4,"Sweet aromatic, some anisic-vanilla notes","['anisic', 'vanilla', 'aromatic', 'sweet']",1.0,1.0,1.0,0.0,1.0,1.0
3140,Eicosane,CCCCCCCCCCCCCCCCCCCC,3637,112-95-8,"Bland, waxy",['waxy'],0.0,-1.0,-1.0,-1.0,-1.0,-1.0
2156,Phenylpropyl propionate,CCC(=O)OCCCc1ccccc1,2405,122-74-7,"Floral, balsamic odor; sweet fruity, green taste","['balsamic', 'floral']",1.0,0.0,1.0,1.0,1.0,1.0
3181,Phenoxyethanol,OCCOc1ccccc1,3693,122-99-6,"Fresh floral, reminiscent of rose absolute, balsamic, cinnamyl note","['rose', 'fresh', 'balsamic', 'floral']",1.0,1.0,1.0,1.0,1.0,0.0
5,Acetaldehyde butyl methylbutyl acetal,CCCCOC(C)OC(C)CCC,5,77249-20-8,"Ethereal, green, alcoholic, cognac, somewhat vegetable","['vegetable', 'alcoholic', 'ethereal', 'green', 'cognac']",1.0,0.0,1.0,1.0,1.0,1.0
582,Dimethyl tetrasulfide,CSSSSC,665,5756-24-1,"Pungent, sulfurous, cooked onion-garlic; meaty, Savory","['meaty', 'garlic', 'savory', 'onion', 'sulfurous', 'pungent']",1.0,1.0,1.0,1.0,0.0,1.0
137,Amyl propionate,CCCCCOC(=O)CC,163,624-54-4,"Sweet, fruity, banana, apple and pineapple; mixed fruit tropical note","['apple', 'fruity', 'banana', 'tropical', 'pineapple', 'sweet']",1.0,1.0,0.0,1.0,1.0,1.0
1455,Mercaptohexyl acetate,CCCC(S)CCOC(C)=O,1636,136954-20-6,"Tropical fruit, passionfruit, sulfurous, black currant, guava, grapefruit","['fruity', 'tropical', 'black currant', 'sulfurous', 'grapefruit']",0.0,-1.0,-1.0,-1.0,-1.0,-1.0
43,Acetoxydimethylfuranone,CC(=O)OC1=C(C)OC(C)C1=O,48,4166-20-5,Stong cooked fruit (strawberry) odor; fruity-caramel (furaneol-like) taste,"['fruity', 'strawberry']",1.0,1.0,1.0,0.0,1.0,1.0
1525,Methyl cinnamate,COC(=O)/C=C/c1ccccc1,1711,103-26-4,Fruity-balsamic odor; sweet fruity (cherry-strawberry) taste,"['fruity', 'balsamic']",1.0,0.0,1.0,1.0,1.0,1.0
68,Acetyltetrahydropyridine,CC(=O)C1=CCCCN1,82,25343-57-1,"Cracker, cereal, popcorn, nutty; effective as meat & savory enhancers","['nutty', 'popcorn']",1.0,0.0,1.0,1.0,1.0,1.0
2442,Undecadienol,CCCCCCCC=CC=CO,2757,56722-23-7,"Herbal, geranium, green, mushroom-like","['green', 'mushroom', 'herbal']",1.0,1.0,1.0,1.0,1.0,0.0
704,Epoxyoxophorone,CC(C)=CC(=O)C=C1COC1=O,794,38284-11-6,"Sweet, minty-camphoraceous, cistus, tobacco, tea notes","['tobacco', 'camphoreous', 'tea', 'sweet', 'mint']",1.0,1.0,1.0,1.0,1.0,0.0
3162,Mercaptoethanol,OCCS,3665,60-24-2,"Burnt-rubber; meaty, poultry-like in dilution; modifier for fruit flavors","['chicken', 'burnt', 'meaty']",1.0,1.0,1.0,1.0,0.0,1.0
739,Ethyl butyl sulfide,CCCCSCC,830,638-46-0,"Sulfurous, green vegetative; allium, eggy, meaty, seafood notes","['vegetable', 'meaty', 'green', 'alliaceous', 'sulfurous']",1.0,1.0,1.0,1.0,0.0,1.0
1686,Methylcyclohexadione,CC1CCCC(=O)C1=O,1882,3008-43-3,Burnt caramel-like odor & taste; somewaht coffee-phenolic,"['phenolic', 'burnt', 'caramellic', 'coffee']",1.0,1.0,1.0,1.0,0.0,1.0
2392,Tolylpropionaldehyde,Cc1ccc(C(C)C=O)cc1,2699,99-72-9,"Strong, fresh, sweet, green, woody odor","['green', 'fresh', 'herbal', 'woody', 'floral', 'sweet']",1.0,1.0,1.0,1.0,0.0,1.0
1947,Nonenol,CC/C=C\CCCCCO,2175,35854-86-5,"Waxy, fruity, green, melon aroma; melon taste","['green', 'fruity', 'waxy', 'melon']",1.0,1.0,1.0,0.0,1.0,1.0
3128,Hexylidenehexanal,CCCCC/C=C(/C=O)CCCC,3625,13019-16-4,"Adds fatty, citrus, green, grassy, aldehydic and fruity flavor notes","['grassy', 'citrus', 'green', 'fatty', 'fruity', 'aldehydic']",0.0,-1.0,-1.0,-1.0,-1.0,-1.0
3293,Methylpentanone,CCC(=O)C(C)C,3884,565-69-5,"Ethereal, fruity, ketonic, minty","['fruity', 'ketonic', 'ethereal', 'mint']",1.0,1.0,1.0,1.0,1.0,0.0
1911,Nonadienal,CC/C=C\CC/C=C/C=O,2137,557-48-2,"Odor like cucumber, green melon or violet leaf in dilution","['green', 'melon', 'violet', 'leafy', 'cucumber']",1.0,1.0,0.0,1.0,1.0,1.0
3027,Propyl isohexanoate,CCCOC(=O)CCC(C)C,3487,25415-68-3,"Fruity, pineapple-apple notes","['fruity', 'apple', 'pineapple']",1.0,1.0,1.0,1.0,1.0,0.0
161,Ascorbic acid,O=C1C(O)=C(O)OC1C(O)CO,190,50-81-7,"Odorless with a sharp, pleasant acid taste",['odorless'],1.0,1.0,1.0,1.0,1.0,0.0
1325,Isoprenyl benzoate,C=C(C)C=COC(=O)c1ccccc1,1477,5205-12-9,"Sweet balsamic, tea-like, floral","['tea', 'balsamic', 'floral', 'sweet']",0.0,-1.0,-1.0,-1.0,-1.0,-1.0
1319,Isopentylidene isopentylamine,CC(C)CC=NCCC(C)C,1471,35448-31-8,"Oily, slightly sweet, shellfish, burned fish, cocoa notes","['oily', 'fishy', 'cocoa', 'burnt', 'sweet']",1.0,1.0,1.0,0.0,1.0,1.0
3374,Ethyldimethylhydrocinamaldehyde,CCc1ccc(CC(C)(C)C=O)cc1,3996,67634-15-5,"Floral, Aldehydic, Ozone (Fresh Air/Marine), Muguet","['aldehydic', 'floral']",1.0,1.0,0.0,1.0,1.0,1.0
1973,Octadienone,CCC=CC=CC(C)=O,2205,65213-86-7,"Geranium-like, green, metallic, earthy, mushroom, fishy odor;","['green', 'earthy', 'fishy', 'metallic', 'mushroom']",0.0,-1.0,-1.0,-1.0,-1.0,-1.0
3022,Phenylpropyl decanoate,CCCCCCCCCC(=O)OCCCc1ccccc1,3479,,"Mild, oily-fruity, slightly green-bland odor reminiscent of unripe Banana,","['green', 'oily', 'fruity', 'banana']",0.0,-1.0,-1.0,-1.0,-1.0,-1.0
1935,Nonanone,CCCCCCC(=O)CC,2163,925-78-0,"Grassy, green-herbaceous fruity odor; herbal, fruity taste","['grassy', 'fruity', 'green', 'herbal']",1.0,1.0,1.0,0.0,1.0,1.0
1624,Methyl undecynoate,CCCCCCCCC#CC(=O)OC,1816,10522-18-6,"Waxy, green, floral (violet) odor; green floral taste","['green', 'violet', 'waxy', 'floral']",1.0,0.0,1.0,1.0,1.0,1.0
3207,Tolualdehyde diethyl acetal,CCOC(OCC)c1ccc(C)cc1,3725,2403-59-0,"Sweet, herbaceous, floral, cherry (bitter almond)","['almond', 'herbal', 'cherry', 'floral', 'sweet']",1.0,1.0,1.0,1.0,0.0,1.0
1924,Nonanal diethyl acetal,CCCCCCCCC(OCC)OCC,2151,54815-13-3,"Fresh, citrus, floral, green note.","['green', 'fresh', 'floral', 'citrus']",1.0,0.0,1.0,1.0,1.0,1.0
3493,Dodecenolide,O=C1C=CCCCCCCCCCO1,4267,301310-73-6,"Mint-tonality, sweet fruity aroma","['fruity', 'sweet', 'mint']",1.0,0.0,1.0,1.0,1.0,1.0
3453,Epoxydecanal,CCCCCCCC1OC1C=O,4155,102369-06-2,"Citrus-like, soapy note",['citrus'],1.0,1.0,1.0,1.0,0.0,1.0
412,Cyclohexanecarboxylic acid,O=C(O)C1CCCCC1,473,98-89-5,"Fruity, cheese like odor (See comments)","['fruity', 'cheesy']",0.0,-1.0,-1.0,-1.0,-1.0,-1.0
3225,Hexenyl acetate,C=CC(CCC)OC(C)=O,3752,35926-04-6,Green fruity rum-like odor; somewhat mushroom taste,"['green', 'fruity', 'rum']",1.0,1.0,1.0,0.0,1.0,1.0
2463,Valeraldehyde diisobutyl acetal,CCCCC(OCC(C)C)OCC(C)C,2780,13262-27-6,"Green, somewhat alcoholic, fermented","['green', 'fermented', 'alcoholic']",1.0,1.0,1.0,1.0,1.0,0.0
1065,Hexanal,CCCCCC=O,1191,66-25-1,"Strong, penetrating, fatty-green, grassy unripe fruit odor","['grassy', 'green', 'fatty', 'fruity']",1.0,0.0,1.0,1.0,1.0,1.0
1327,Isoprenyl hexanoate,C=C(C)C=COC(=O)CCCCC,1479,53655-22-4,"Green, fruity, tropical & pineapple note","['green', 'fruity', 'pineapple', 'tropical']",1.0,1.0,0.0,1.0,1.0,1.0
852,Ethylbutyl acetate,CCC(CC)COC(C)=O,949,10031-87-5,"Fruity, banana-pear, slight fermenty-musty odor & taste","['fruity', 'banana', 'pear', 'fermented', 'musty']",1.0,1.0,1.0,1.0,0.0,1.0
2298,Sinapinaldehyde,COc1cc(/C=C/C=O)cc(OC)c1O,2579,4206-58-0,"Sweet, spicy","['spicy', 'sweet']",0.0,-1.0,-1.0,-1.0,-1.0,-1.0
978,Germacrene D,C=C1/C=C/C(C(C)C)CC/C(C)=C/CC1,1088,23986-74-5,"Woody, minty, hay, tea, herbal, tobacco notes","['hay', 'tobacco', 'herbal', 'tea', 'woody', 'mint']",1.0,0.0,1.0,1.0,1.0,1.0
3368,Dimethoxybenzaldehyde,COc1cccc(C=O)c1OC,3990,86-51-1,"Sweet, aromatic, spicy, slightly vanilla","['vanilla', 'spicy', 'aromatic', 'sweet']",1.0,1.0,1.0,1.0,0.0,1.0
2697,Citral hexylene glycol acetal,CC(C)=CCC/C(C)=C/C1OC(C)CC(C)(C)O1,3085,68258-94-6,Somewhat oily-citrus (lemon) with herbaceous aspects,"['oily', 'lemon', 'citrus', 'herbal']",1.0,1.0,1.0,0.0,1.0,1.0
486,Di-isoamyl succinate,CC(C)CCOC(=O)CCC(=O)OCCC(C)C,554,818-04-2,"Mild fruity odor, gooseberry-grape winey notes","['fruity', 'grape', 'winey']",1.0,0.0,1.0,1.0,1.0,1.0
3073,Methylfurylpropanedione,CC(=O)C(=O)c1ccc(C)o1,3552,1197-20-2,"Caramellic, burnt note","['burnt', 'caramellic']",1.0,0.0,1.0,1.0,1.0,1.0
2354,Tetramethylethylcyclohexenone (mixture of isomers),CCC1(C)CC(=O)C(C)=C(C)C1C,2655,17369-60-7,"Caramellic-sugary, creamy, fruity, nut-like odor and taste","['creamy', 'caramellic', 'fruity', 'nutty']",1.0,1.0,1.0,1.0,1.0,0.0
3458,Ethoxymethylpyrazine,CCOc1cncc(C)n1,4162,53163-97-6,Strong odor and flavor of fresh pineapple,"['pineapple', 'fresh']",0.0,-1.0,-1.0,-1.0,-1.0,-1.0
1604,Methyl propanethioate,O=C(CSCc1nc2ccccc2[nH]1)Nc1ccc2ccccc2c1,1796,5925-75-7,"Cooked cabbage, ripened cheese notes; dairy, tropical fruit notes","['ripe', 'fruity', 'tropical', 'cabbage', 'dairy', 'cheesy']",1.0,1.0,0.0,1.0,1.0,1.0
2137,Phenylpropanol,OCCCc1ccccc1,2386,122-97-4,"Balsamic, floral odor; a balsamic, spicy, honey, preserved fruit taste","['balsamic', 'floral']",1.0,1.0,1.0,1.0,0.0,1.0
299,Butyl undecenoate,C=CCCCCCCCCC(=O)OCCCC,336,109-42-2,"Fatty-waxy, buttery, wine-brandy notes; creamy buttery, fatty vinous taste","['fatty', 'waxy', 'buttery', 'winey', 'brandy']",0.0,-1.0,-1.0,-1.0,-1.0,-1.0
1130,Hexenyl tiglate,C/C=C(/C)C(=O)OCC/C=C/CC,1267,67883-79-8,"Green herbal, vegetative fruity odor; vegetative, mushroom taste","['green', 'vegetable', 'fruity', 'herbal']",1.0,1.0,1.0,1.0,1.0,0.0
1120,Hexenyl methylbutanoate,CC/C=C\CCOC(=O)C(C)CC,1254,10094-41-4,Fruity green apple odor; green apple taste,"['apple', 'green', 'fruity', 'pear', 'pineapple']",0.0,-1.0,-1.0,-1.0,-1.0,-1.0
2320,Terpinenol,CC1=CCC(O)(C(C)C)CC1,2620,562-74-3,"Sweet, green, citrus, cooling, musty; slightly peppery woody notes","['citrus', 'green', 'woody', 'musty', 'sweet']",1.0,1.0,0.0,1.0,1.0,1.0
2723,Hexylmethoxypyrazine,CCCCCCc1nccnc1OC,3118,,Characteristic green bell pepper,['green'],1.0,1.0,1.0,1.0,0.0,1.0
2055,Pentenoic acid,C=CCCC(=O)O,2302,591-80-0,"Sour, caramellic strong cheese odor; sweet fruity-cheese taste","['caramellic', 'sour', 'cheesy']",1.0,1.0,1.0,1.0,0.0,1.0
2234,Propyl lactate,CCCOC(=O)C(C)O,2493,616-09-1,"Light, sweet, milky, caramellic odor; sweet, milk-like taste","['milky', 'caramellic', 'sweet']",1.0,1.0,1.0,0.0,1.0,1.0
284,Butyl methylbutanethioate,CCC(C)SC(=O)CC(C)C,320,2432-91-9,"Sulfurous, green-vegetative galbanum notes; cheese & tropical fruit","['vegetable', 'green', 'fruity', 'tropical', 'sulfurous', 'cheesy']",1.0,1.0,1.0,1.0,0.0,1.0
2893,Heptyl isocaproate,CCCCCCCOC(=O)CCC(C)C,3331,,"Oily-fruity, winey-herbaceous, reminiscent of unripe fruit","['oily', 'fruity', 'herbal', 'winey']",1.0,1.0,1.0,1.0,0.0,1.0
2355,Tetramethylpyrazine,Cc1nc(C)c(C)nc1C,2656,1124-11-4,"Mild, nutty, musty, chocolate odor; chocolate, nutty  taste","['nutty', 'musty', 'chocolate']",1.0,1.0,1.0,0.0,1.0,1.0
159,Arachidonic acid,CCCCC/C=C/C/C=C/C/C=C/C/C=C/CCCC(=O)O,187,506-32-1,"Fatty; Develops fatty, fishy notes on oxidation","['fatty', 'fishy']",1.0,0.0,1.0,1.0,1.0,1.0
2036,Pentadecane,CCCCCCCCCCCCCCC,2281,629-62-9,"Mild waxy, hydrocarbon odor","['waxy', 'gasoline']",0.0,-1.0,-1.0,-1.0,-1.0,-1.0
3434,Methylfurylthiobutanal,CCC(C)(C=O)Sc1ccco1,4104,915971-43-6,"Meaty, juicy, powerful, nice, no off-notes","['fruity', 'meaty']",1.0,1.0,1.0,0.0,1.0,1.0
3343,Tridecane,CCCCCCCCCCCCC,3957,629-50-5,Hydrocarbon odor,['gasoline'],1.0,1.0,1.0,1.0,1.0,0.0
2218,Propyl butyrate,CCCOC(=O)CCC,2477,105-66-8,"Fruity, sweet, mixed fruit odor; a sweet mixed fruit, pineapple flavor","['fruity', 'sweet']",1.0,0.0,1.0,1.0,1.0,1.0
2918,Hexyl isocaproate,CCCCCCOC(=O)CCC(C)C,3358,,"Sweet, green, herbaceous-fruity","['green', 'fruity', 'sweet', 'herbal']",1.0,0.0,1.0,1.0,1.0,1.0
192,Benzyl isovalerate,CC(C)CC(=O)OCc1ccccc1,223,103-38-8,"Fruity, herbaceous, with apple, tobacco, cheese notes","['apple', 'fruity', 'tobacco', 'herbal', 'cheesy']",0.0,-1.0,-1.0,-1.0,-1.0,-1.0
2398,Tridecanal,CCCCCCCCCCCCC=O,2706,10486-19-8,"Fatty, waxy, orange citrus odor; ripe citrus, orange-tangerine taste","['fatty', 'waxy', 'orange', 'citrus']",1.0,0.0,1.0,1.0,1.0,1.0
2029,Oxobutyric acid,CCC(=O)C(=O)O,2266,600-18-0,"Sweet, brown, creamy, caramellic, fatty nuance  (see comments)","['creamy', 'caramellic', 'fatty', 'sweet']",0.0,-1.0,-1.0,-1.0,-1.0,-1.0
1247,Isobornyl isobutyrate,CC(C)C(=O)O[C@@H]1C[C@H]2CC[C@]1(C)C2(C)C,1390,85586-67-0,"Herbal earthy-nutty, camphoraceous, pine cone like, fruity odor","['pine', 'earthy', 'nutty', 'fruity', 'camphoreous', 'herbal']",1.0,1.0,1.0,0.0,1.0,1.0
686,Dodecalactone,CCCCCCCCC1CCC(=O)O1,776,2305-05-7,"Fatty, fruity, peach odor; milky-peach like taste","['fatty', 'fruity', 'peach']",1.0,1.0,1.0,0.0,1.0,1.0
1345,Isopropyl mercaptan,CC(C)S,1497,75-33-2,"Meaty sulfurous, brothy chicken and poultry, leek and onion-like","['meaty', 'onion', 'chicken', 'brothy', 'sulfurous']",1.0,1.0,1.0,1.0,1.0,0.0
1704,Methylfuran,Cc1ccco1,1902,534-22-5,"Sweet-gassy, solvent, metallic-burnt with musty nutty notes","['solvent', 'nutty', 'gasoline', 'metallic', 'burnt', 'musty', 'sweet']",1.0,1.0,0.0,1.0,1.0,1.0
398,Citronellyl propionate,CCC(=O)OCCC(C)CCC=C(C)C,456,141-14-0,"Sweet fruity rose odor; bittersweet, floral-green-citrus-plum-like taste","['fruity', 'rose', 'sweet']",0.0,-1.0,-1.0,-1.0,-1.0,-1.0
2701,Cresyl ethyl ether,CCOc1ccc(C)cc1,3089,622-60-6,"Sweet hyacinth, Ylang type note; somewhat pungent-harsh","['pungent', 'sweet']",1.0,1.0,1.0,0.0,1.0,1.0
1659,Isoprenyl acetate,C=C(C)CCOC(C)=O,1855,5205-07-2,"Unripe, Green, banana, tropical","['green', 'banana', 'tropical']",1.0,1.0,0.0,1.0,1.0,1.0
417,Cyclohexyl acetate,CC(=O)OC1CCCCC1,478,622-45-7,"Sweet, fruity-banana-apple, solvent odor & taste","['apple', 'solvent', 'fruity', 'banana', 'sweet']",1.0,1.0,1.0,1.0,0.0,1.0
1224,Isoamyl furanbutyrate,CC(C)CCOC(=O)CCCc1ccco1,1367,7779-66-0,"Sweet, buttery, fruity odor with a caramellic taste","['fruity', 'sweet', 'buttery']",1.0,1.0,1.0,1.0,0.0,1.0
962,Geranyl benzoate,CC(C)=CCC/C(C)=C/COC(=O)c1ccccc1,1072,94-48-4,"Amber-rose, ylang-ylang like, floral odor","['floral', 'rose']",0.0,-1.0,-1.0,-1.0,-1.0,-1.0
240,Butenoic acid,C/C=C/C(=O)O,274,3724-65-0,"Acidic, sharp sour with spicy caramellic notes; weal milky flavor","['spicy', 'caramellic', 'sour', 'milky', 'sharp', 'burnt']",1.0,1.0,1.0,1.0,1.0,0.0
3221,Pinene oxide,CC1(C)C2CC3OC3(C)C1C2,3746,1686-14-2,"Sweet, fresh, terpy, rotten pine-like","['pine', 'fresh', 'sweet']",1.0,0.0,1.0,1.0,1.0,1.0
604,Dimethylethylphenol,CC(C)(C)c1ccc(O)cc1,687,98-54-4,"Leathery phenolic odor, smoky-spicy flavor","['phenolic', 'leathery']",1.0,1.0,1.0,0.0,1.0,1.0
1007,Heptanethiol,CCCCCCCS,1128,1639-09-4,"Sulfurous, onion, vegetative, savory & fatty-meaty notes on dilution","['vegetable', 'meaty', 'fatty', 'savory', 'onion', 'sulfurous']",0.0,-1.0,-1.0,-1.0,-1.0,-1.0
176,Benzyl acetoacetate,CC(=O)CC(=O)OCc1ccccc1,207,5396-89-4,"Pleasant, fresh, floral, balsamic fruity  odor","['fruity', 'balsamic', 'fresh', 'floral']",0.0,-1.0,-1.0,-1.0,-1.0,-1.0
1481,Methoxycinnamaldehyde,COc1ccccc1/C=C/C=O,1664,1504-74-1,"Sweet, warm, spicy-cassia odor; sweet cinnamon like taste","['spicy', 'sweet', 'warm']",1.0,1.0,1.0,1.0,1.0,0.0
1391,Jasmone,CC/C=C\CC1=C(C)CCC1=O,1548,488-10-8,"Floral jasmine fruity odor; sweet woody, tea, citrus & floral taste","['fruity', 'floral', 'jasmine']",1.0,1.0,1.0,0.0,1.0,1.0
2500,Dimethyltetrahydrofuryl thioacetate,CC(=S)OC1(C)OCCC1C,2824,252736-39-3,"Sulfurous, roasted meaty","['sulfurous', 'meaty', 'roasted']",1.0,1.0,1.0,1.0,0.0,1.0
2872,Ethyl p-Methyl-beta-Phenylglycidate,CCOC(=O)C1OC1c1ccc(C)cc1,3307,52788-71-3,"Sweet, powerfull fruity, raspberry-like odor","['fruity', 'sweet']",1.0,1.0,1.0,0.0,1.0,1.0
1206,Ionol,CC1=C(/C=C/C(C)O)C(C)(C)CCC1,1349,22029-76-1,"Floral, violet like, fruity, woody, berry with powdery nuances","['fruity', 'violet', 'berry', 'woody', 'floral']",1.0,1.0,1.0,0.0,1.0,1.0
2831,Dipropyl adipate,CCCOC(=O)CCCCC(=O)OCCC,3257,106-19-4,"Nearly odorless, possibly used as a co-solvent","['solvent', 'odorless']",1.0,1.0,1.0,1.0,1.0,0.0
923,Fructose,O=C(CO)[C@@H](O)[C@H](O)[C@H](O)CO,1028,57-48-7,Sugar sweet,['sweet'],1.0,1.0,0.0,1.0,1.0,1.0
469,Decenol,C=CCCCCCCCCO,537,13019-22-2,"Waxy, fresh, dewy, aldehydic, rosy odor","['rose', 'fresh', 'aldehydic', 'waxy']",0.0,-1.0,-1.0,-1.0,-1.0,-1.0
849,Ethylbenzaldehyde,CCc1ccc(C=O)cc1,946,4748-78-1,"Bitter-almond; cherry-like, with an herbal (cuminic-anisic-green) note","['green', 'almond', 'herbal', 'anisic', 'cherry']",1.0,0.0,1.0,1.0,1.0,1.0
1085,Hexenol,C=CC(O)CCC,1215,4798-44-1,"Ethereal, rum like odor","['ethereal', 'rum']",0.0,-1.0,-1.0,-1.0,-1.0,-1.0
1508,Methyl acetoxybutyrate,CCC(OC(C)=O)C(=O)OC,1693,89422-42-4,Fruity with apple-pineapple tropical fruit notes,"['fruity', 'apple', 'pineapple', 'tropical']",1.0,1.0,1.0,1.0,1.0,0.0
867,Ethylhexanoic acid,CCCCC(CC)C(=O)O,966,149-57-5,"Mild, fatty-cheese-fruity, sour rancid, herbaceous musty notes","['sour', 'fatty', 'fruity', 'herbal', 'musty', 'cheesy']",0.0,-1.0,-1.0,-1.0,-1.0,-1.0
1019,Heptenoic acid,CCC/C=C\CC(=O)O,1142,29901-85-7,"Green, waxy rancid dairy-like fruity","['green', 'fruity', 'waxy', 'dairy']",0.0,-1.0,-1.0,-1.0,-1.0,-1.0
1617,Methyl sulfide,CSC,1809,75-18-3,"Pungent, cabbage, cooked vegetable odor; corn-like on dilution","['vegetable', 'pungent', 'cabbage']",1.0,1.0,1.0,1.0,0.0,1.0
671,Dipentyl malonate,CCCCCOC(=O)CC(=O)OCCCCC,757,20602-31-7,"Fruity, slightly fatty, winey note","['fruity', 'fatty', 'winey']",1.0,1.0,1.0,1.0,1.0,0.0
3250,Ethyl acetoacetate diethyl acetal,CCOC(=O)CC(C)(OCC)OCC,3810,,"Fresh, fruity, apple notes","['fruity', 'apple', 'fresh']",1.0,1.0,1.0,1.0,0.0,1.0
1098,Hexenyl anisate,CCCCC=COC(=O)c1ccc(OC)cc1,1229,121432-33-5,"Green, fruity, floral, anisic","['green', 'fruity', 'anisic', 'floral']",1.0,1.0,1.0,1.0,1.0,0.0
2030,Oxophenylpropionic acid,O=C(O)C(=O)Cc1ccccc1,2274,156-06-9,"Somewhat burnt, caramellic odor; creamy, dairy & sweetness taste enhancer","['burnt', 'caramellic']",1.0,1.0,1.0,1.0,1.0,0.0
424,Cyclohexyl isovalerate,CC(C)CC(=O)OC1CCCCC1,485,7774-44-9,"Fruity, with apple-banana-berry like notes","['fruity', 'apple', 'banana', 'berry']",1.0,1.0,1.0,0.0,1.0,1.0
297,Butyl stearate,CCCCCCCCCCCCCCCCCC(=O)OCCCC,334,123-95-5,"Odorless or faint, fatty, fruity odor; adds mouthfeel","['odorless', 'fruity', 'fatty']",1.0,1.0,0.0,1.0,1.0,1.0
3010,Octyl crotonate,C/C=C\C(=O)OCCCCCCCC,3466,22874-79-9,"Fresh, herbal-fruity, slightly floral, somewhat lavender-like","['fruity', 'fresh', 'herbal', 'floral']",0.0,-1.0,-1.0,-1.0,-1.0,-1.0
2711,Ethyl methyl ketone propylene glycol ketal,CCC1(C)OCC(C)O1,3101,2916-28-1,"Ethereal, with some fruity-minty aspects","['fruity', 'ethereal', 'mint']",1.0,1.0,1.0,0.0,1.0,1.0
3306,Phenylbutanoic acid,O=C(O)CCCc1ccccc1,3911,1821-12-1,"Sweet-heavy, floral-honey-like odor","['honey', 'floral', 'sweet']",1.0,1.0,1.0,1.0,0.0,1.0
2582,Heptylcyclopropanecarboxylic acid,CCCCCCCC1(C(=O)O)CC1,2943,697290-77-0,"Woody, balsamic, incense-like, green, herbal, pith-like, waxy","['green', 'waxy', 'herbal', 'woody', 'balsamic']",1.0,1.0,1.0,1.0,0.0,1.0
2662,Acetone glyceryl acetal(s),CC1(C)OCC(CO)O1,3043,100-79-8,"Mild, non-descript, slightly solventy-fruity","['fruity', 'solvent']",1.0,1.0,1.0,1.0,1.0,0.0
656,Dimethyltetrahydrofuran,CC1CCC(C)O1,742,1003-38-9,"Sweet, ethereal, somewhat gassy-minty solvent odor","['solvent', 'ethereal', 'gasoline', 'sweet', 'mint']",1.0,1.0,1.0,1.0,0.0,1.0
1337,Isopropyl crotonate,C/C=C/C(=O)OC(C)C,1489,6284-46-4,"Sweet, fruity, apple, chamomille like notes","['fruity', 'apple', 'chamomile', 'sweet']",1.0,1.0,1.0,1.0,0.0,1.0
1031,Heptyl acetate,CCCCCCCOC(C)=O,1156,112-06-1,"Fruity, fatty, slight floral odor; pear-apricot taste","['fruity', 'fatty', 'floral']",0.0,-1.0,-1.0,-1.0,-1.0,-1.0
249,Butyl acetate,CCCCOC(C)=O,285,123-86-4,"Strong, sweet, fruity; banana, pear, pineapple notes","['fruity', 'banana', 'pear', 'pineapple', 'sweet']",1.0,1.0,1.0,0.0,1.0,1.0
2934,Isobutyl 2-methylvalerate,CCCC(C)C(=O)OCC(C)C,3374,,"Fruity, mildly oily, fatty, apple connotation","['oily', 'fruity', 'apple', 'fatty']",1.0,1.0,1.0,1.0,1.0,0.0
2828,Dimethylbenzyl acetate,CC(=O)OC(C)(C)c1ccccc1,3254,3425-72-7,"Floral, fruity","['fruity', 'floral']",1.0,1.0,0.0,1.0,1.0,1.0
3017,Phenoxyethyl acetate,CC(=O)OCCOc1ccccc1,3473,6192-44-5,"Fruity-floral, somewhat herbaceous connotation odor","['fruity', 'floral', 'herbal']",1.0,1.0,0.0,1.0,1.0,1.0
3288,Hexanedione,CC(=O)CCC(C)=O,3877,110-13-4,"Fresh herbaceous, burnt sugar character","['fresh', 'burnt', 'herbal']",1.0,0.0,1.0,1.0,1.0,1.0
189,Benzyl hexanoate,CCCCCC(=O)OCc1ccccc1,220,6938-45-0,"Sweet fruity, with pineapple, tropical, green, floral, apricot, peach note","['apricot', 'green', 'fruity', 'tropical', 'peach', 'pineapple', 'floral', 'sweet']",1.0,1.0,0.0,1.0,1.0,1.0
907,Eugenyl formate,C=CCc1ccc(OC=O)c(OC)c1,1010,10031-96-6,"Sweet, woody, dry, orris-clove like odor; woody, spicy taste","['orris', 'woody', 'sweet', 'dry']",1.0,1.0,1.0,0.0,1.0,1.0
2673,Octene,C/C=C\CCCCC,3058,111-67-1,"Hydrocarbon, gassy (gasoline) notes",['gasoline'],1.0,1.0,1.0,0.0,1.0,1.0
1849,Methylthiomethyl butyrate,CCCC(=O)OCSC,2063,74758-93-3,"Tropical, exotic fruit notes; also cabbage, milky, cheese","['fruity', 'milky', 'tropical', 'cabbage', 'cheesy']",1.0,1.0,1.0,0.0,1.0,1.0
1510,Methyl acetoxyhexanoate,CCCC(CC(=O)OC)OC(C)=O,1695,21188-60-3,"Fruity green lettuce  type odor, sweet green fruity taste","['green', 'fruity']",1.0,1.0,0.0,1.0,1.0,1.0
2050,Pentanone,CCC(=O)CC,2297,96-22-0,"Ethereal, caramel; slight fruity cheese note","['fruity', 'caramellic', 'ethereal', 'cheesy']",0.0,-1.0,-1.0,-1.0,-1.0,-1.0
2017,Octyl hexanoate,CCCCCCCCOC(=O)CCCCC,2252,4887-30-3,"Sweet, slightly oily-fruity, green. and un-interesting.","['green', 'oily', 'fruity', 'sweet']",1.0,1.0,1.0,1.0,1.0,0.0
