,chemical_name,smiles,database_id,cas,odor_data,odor_labels_filtered,labels_trainAndtest,labels_cv0,labels_cv1,labels_cv2,labels_cv3,labels_cv4
3444,Mercaptomethylbutyl isovalerate,CCCC(CS)OC(=O)CC(C)C,4128,612071-27-9,"Sulfurous, Tropical fruit notes,effective in grape","['fruity', 'tropical', 'grape', 'sulfurous']",0.0,-1.0,-1.0,-1.0,-1.0,-1.0
2327,Terpinyl butyrate,CCCC(=O)OC(C)(C)C1CC=C(C)CC1,2627,2153-28-8,"Fruity, sour, herbaceous-balsamic odor; apple-plum taste","['fruity', 'balsamic', 'sour', 'herbal']",1.0,0.0,1.0,1.0,1.0,1.0
654,Dimethylquinoxaline,Cc1nc2ccccc2nc1C,740,2379-55-7,Astringent; fatty; earthy at 25 ppm in coffee; roasted,"['fatty', 'roasted']",1.0,1.0,1.0,0.0,1.0,1.0
1690,Methylcyclohexenone,CC1=CC(=O)CCC1,1886,1193-18-6,"Caramel, nutty, musty and minty notes","['nutty', 'caramellic', 'mint', 'musty']",1.0,1.0,1.0,1.0,1.0,0.0
2417,Trimethylcyclohexenone,CC1=CCCC(C)(C)C1=O,2729,20013-73-4,"Sharp, herbaceous-camphoraceous odor; thujone-tobacco notes","['tobacco', 'sharp', 'camphoreous', 'herbal']",1.0,1.0,0.0,1.0,1.0,1.0
2956,Menthyl crotonate,C/C=C/C(=O)OC1CC(C)CCC1C(C)C,3398,,"Fresh, herbaceous, minty","['fresh', 'mint', 'herbal']",1.0,1.0,0.0,1.0,1.0,1.0
2126,Phenylethyl heptanoate,CCCCCCC(=O)OCCc1ccccc1,2375,5454-11-5,"Weak citrus, some orange notes and oily-winey, earthy herbaceous","['citrus', 'earthy', 'oily', 'orange', 'herbal', 'winey']",1.0,1.0,1.0,1.0,0.0,1.0
1306,Isoeugenyl ethyl ether,C/C=C/c1ccc(OCC)c(OC)c1,1456,7784-67-0,"Spicy clove like; warm, balsamic vanilla undertones","['spicy', 'vanilla', 'warm', 'balsamic']",1.0,1.0,1.0,1.0,1.0,0.0
3517,"Bicycloheptenecarboxylic acid, ethyl ester",CCOC(=O)C1CC2C=CC1C2,4312,10138-32-6,"Fruity, green, watery, and honey dew notes","['green', 'fruity', 'honey']",1.0,0.0,1.0,1.0,1.0,1.0
3202,Hexadienal diethyl acetal,C/C=C/C=C/C(OCC)OCC,3717,27310-22-1,"Green, tropical","['green', 'tropical']",1.0,1.0,1.0,1.0,0.0,1.0
626,Dimethyloctadienylcyclopentanone,CC(C)=CCC/C(C)=C/CC1CCCC1=O,711,68133-79-9,"Fresh apricot-peach fruity note, with pulp-kernel character","['apricot', 'fruity', 'fresh', 'peach']",1.0,1.0,0.0,1.0,1.0,1.0
1868,Methylthiopropylamine,CSCCCN,2083,4104-45-4,"Sulfurous, fishy, amine, potato, vegetative, ripe cheese in dilution","['ripe', 'vegetable', 'fishy', 'sulfurous', 'potato', 'cheesy']",1.0,1.0,0.0,1.0,1.0,1.0
2119,Phenylbutanone,CCCC(=O)c1ccccc1,2368,495-40-9,"Sweet floral fruity, vanlla, buttery,creamy, nut like","['creamy', 'fruity', 'vanilla', 'nutty', 'floral', 'sweet', 'buttery']",1.0,1.0,1.0,1.0,1.0,0.0
2950,Isopropylcyclohexyl acetate,CC(=O)OC1(C(C)C)CCCCC1,3391,15876-32-1,"Woody-minty, sweet-camphoraceous, fruity","['fruity', 'camphoreous', 'woody', 'sweet', 'mint']",1.0,1.0,1.0,1.0,1.0,0.0
2162,Phthalide,O=C1OCc2ccccc21,2412,87-41-2,"Sweet, coumarin with sweet, hay, heliotropin & almond topnotes","['hay', 'sweet', 'almond', 'coumarinic']",1.0,1.0,1.0,1.0,1.0,0.0
709,Ethanethiol,CCS,800,75-08-1,"Sulfurous, rubbery, vegetative, onion, garlic, meaty, coffee, tropical","['vegetable', 'meaty', 'garlic', 'tropical', 'onion', 'coffee', 'sulfurous']",0.0,-1.0,-1.0,-1.0,-1.0,-1.0
1227,Isoamyl hexanoate,CCCCCC(=O)OCCC(C)C,1370,2198-61-0,"Fruity, apple-banana-pineapple, somewhat waxy aroma & taste","['apple', 'fruity', 'banana', 'waxy', 'pineapple']",1.0,0.0,1.0,1.0,1.0,1.0
1692,Methylcyclopentenolone butyrate,CCCC(=O)OC1=C(C)CCC1=O,1888,68227-51-0,"Caramellic, maple, lovage, creamy, buttery, nutty","['creamy', 'caramellic', 'nutty', 'buttery']",1.0,1.0,0.0,1.0,1.0,1.0
51,Acetyldimethylpyrazine,CC(=O)[n+]1cc(C)nc(C)c1,58,72797-17-2,"Nutty, popcorn, roasted hazelnut","['nutty', 'hazelnut', 'popcorn', 'roasted']",1.0,1.0,0.0,1.0,1.0,1.0
3503,Dimethoxypropane,COC(C)(C)OC,4284,77-76-9,"Fresh, ethereal, choking, solventy","['fresh', 'solvent', 'ethereal']",1.0,1.0,1.0,1.0,1.0,0.0
2508,Hydroxymethylhexanone,CCCCC(=O)CCO,2832,163038-04-8,"Green, pungent, roasted and cocoa-like flavor, cheese notes, masks soy","['green', 'pungent', 'roasted', 'cheesy']",1.0,0.0,1.0,1.0,1.0,1.0
2372,Thymol,Cc1ccc(C(C)C)c(O)c1,2677,89-83-8,"Strong, sweet, medicinal-herbaceous, spicy-phenolic odor/taste","['spicy', 'herbal', 'phenolic', 'medicinal', 'sweet']",1.0,1.0,1.0,1.0,0.0,1.0
294,Butyl phenylacetate,CCCCOC(=O)Cc1ccccc1,330,122-43-0,"Sweet, rose-honey aroma; sweet honey taste","['honey', 'rose', 'sweet']",0.0,-1.0,-1.0,-1.0,-1.0,-1.0
653,Dimethylpyrrolidinodithiazine,CC1=C(C)C(N2CCCC2)=NSS1,739,116505-60-3,"Powerful shellfish seafood note on dilution; roasted meaty, groundnuts","['meaty', 'roasted']",1.0,1.0,1.0,0.0,1.0,1.0
136,Amyl phenylacetate,CCCCCOC(=O)Cc1ccccc1,162,5137-52-0,"Sweet balsamic, honey-apple fruity like","['apple', 'fruity', 'honey', 'balsamic', 'sweet']",0.0,-1.0,-1.0,-1.0,-1.0,-1.0
2488,Xylenol,Cc1cccc(O)c1C,2811,526-75-0,"Leathery, caryophyllene, spicy, animalic odor; cresolic taste at 0.1 ppm","['spicy', 'leathery', 'animal']",1.0,1.0,0.0,1.0,1.0,1.0
3469,Undecenal,CCCCCCCCC=CC=O,4183,68820-35-9,"Fatty, aldehydic with floral, green, and slight citrus notes","['citrus', 'green', 'fatty', 'aldehydic', 'floral']",1.0,1.0,1.0,0.0,1.0,1.0
2186,Prenyl salicylate,CC(C)=CCOC(=O)c1ccccc1O,2443,68555-58-8,"Floral, sweet-herbaceous, light woody odor","['herbal', 'woody', 'floral', 'sweet']",1.0,1.0,0.0,1.0,1.0,1.0
946,Furfuryl thioacetate,CC(=O)SCc1ccco1,1053,13678-68-7,"Burnt, roasted, alliaceous, garlic, savory, coffee-like","['roasted', 'alliaceous', 'garlic', 'savory', 'burnt', 'coffee']",1.0,1.0,1.0,1.0,0.0,1.0
2774,Allyl pivalate,C=CCOC(=O)C(C)(C)C,3183,,"Fruity, green-herbal, tropical","['green', 'fruity', 'tropical', 'herbal']",1.0,1.0,1.0,0.0,1.0,1.0
1017,Heptenal,CC/C=C/CCC=O,1138,62238-34-0,Odor like cream and fried fats on dilution & buttery taste,"['creamy', 'green', 'fatty', 'melon']",0.0,-1.0,-1.0,-1.0,-1.0,-1.0
3424,Safrole,C=CCc1ccc2c(c1)OCO2,4088,94-59-7,"Aromatic, spicy, reminiscent of sassafras","['spicy', 'aromatic']",0.0,-1.0,-1.0,-1.0,-1.0,-1.0
2932,Isoamyl undecanoate,CCCCCCCCCCC(=O)OCCC(C)C,3372,,"Oily, rosy with vinous-brandy undertones","['rose', 'oily', 'brandy']",0.0,-1.0,-1.0,-1.0,-1.0,-1.0
1463,Mercaptomethylpropylthiobutanol,CCCSC(O)(CS)CCC,1644,76801-35-8,"Sulfurous, meaty, liver, onion (See Comments)","['onion', 'sulfurous', 'meaty']",1.0,1.0,1.0,0.0,1.0,1.0
275,Butyl hexenoate,CC/C=C/CC(=O)OCCCC,311,118869-62-8,"Fruity, green, apple, tropical notes","['green', 'fruity', 'apple', 'tropical']",0.0,-1.0,-1.0,-1.0,-1.0,-1.0
179,Benzyl butyl ether,CCCCOCc1ccccc1,210,588-67-0,"Sweet, sharp, fruity, floral (rose-geranium) odor; used in fruit flavors","['rose', 'fruity', 'sharp', 'floral', 'sweet']",0.0,-1.0,-1.0,-1.0,-1.0,-1.0
460,Decenal,CCC/C=C/C=C/CCCO,526,21662-09-9,"Diffusive, powerful, citrus-orange, cardamom, rancid, waxy-floral odor","['citrus', 'waxy', 'orange', 'floral']",0.0,-1.0,-1.0,-1.0,-1.0,-1.0
327,Caffeine,Cn1c(=O)c2c(ncn2C)n(C)c1=O,373,58-08-2,Odorless with a bitter taste; a flavor enhancer in soft drinks,['odorless'],1.0,1.0,0.0,1.0,1.0,1.0
1870,Methyltridecanal,CC(C)CCCCCCCCCCC=O,2085,75853-49-5,"Tallowy, beef-like; characteristic odorant of stewed beef juice","['meaty', 'beefy']",1.0,1.0,1.0,1.0,1.0,0.0
2777,Amyl butenoate,C/C=C\C(=O)OCCCCC,3186,25415-76-3,"Fruity, fresh, slightly pungent; apple, chamomile aspects","['apple', 'fruity', 'fresh', 'chamomile', 'pungent']",1.0,1.0,1.0,0.0,1.0,1.0
2920,Hexyl pivalate,CCCCCCOC(=O)C(C)(C)C,3360,5434-57-1,"Strong green, fruity, pear, apple, rather harsh","['apple', 'green', 'fruity', 'pear']",1.0,1.0,1.0,1.0,0.0,1.0
2321,Terpineol (isomers not specified),CC1=CCC(C(C)(C)O)CC1,2621,8000-41-7,"Sweet, floral (lilac), lime odor; very sweet taste in dilution","['floral', 'sweet']",1.0,1.0,1.0,1.0,0.0,1.0
347,Carvyl isovalerate,C=C(C)C1CC=C(C)C(OC(=O)CC(C)C)C1,404,94386-39-7,"Sweet, herbaceous, fruity with a hint of spearmint","['fruity', 'herbal', 'sweet']",1.0,1.0,1.0,1.0,1.0,0.0
1558,Methyl isoprenyl sulfide,C=C(C)C=CSC,1746,5897-45-0,"Garlic, rubbery, onion flavor (in beer)",['garlic'],1.0,0.0,1.0,1.0,1.0,1.0
3023,Phenylpropyl salicylate,O=C(OCCCc1ccccc1)c1ccccc1O,3480,24781-13-3,"Weak, sweet, balsamic with a floral undertone","['balsamic', 'floral', 'sweet']",1.0,1.0,1.0,1.0,0.0,1.0
1216,Isoamyl acetoacetate,CC(=O)CC(=O)OCCC(C)C,1359,2308-18-1,"Sweet, fruity, ethereal, winey odor; green-apple flavor","['fruity', 'winey', 'sweet', 'ethereal']",1.0,1.0,1.0,1.0,1.0,0.0
2886,Eugenyl phenylacetate,C=CCc1ccc(OC(=O)Cc2ccccc2)c(OC)c1,3323,10402-33-2,"Warm, sweet aromatic, spicy-honey note","['spicy', 'honey', 'warm', 'aromatic', 'sweet']",1.0,1.0,1.0,0.0,1.0,1.0
605,Dimethylethylthiazole,CCc1nc(C)sc1C,688,32272-57-4,"Burnt, earthy, coffee & potato flavor","['earthy', 'potato', 'burnt', 'coffee']",1.0,1.0,0.0,1.0,1.0,1.0
6,Acetaldehyde butyl phenethyl acetal,CCCCOC(C)OCCc1ccccc1,6,64577-91-9,"Green vegetable odor; nutty, green pea/green pepper taste","['green', 'vegetable']",1.0,1.0,1.0,0.0,1.0,1.0
1175,Hydroxybutanone,CCC(=O)CO,1315,5077-67-8,"Brown, caramellic, oily and alcoholic with toasted grain notes","['alcoholic', 'caramellic', 'oily']",1.0,0.0,1.0,1.0,1.0,1.0
2430,Trimethylpyrazine,Cc1cnc(C)c(C)n1,2742,14667-55-1,"Baked potato, roasted nut, cocoa, coffee, burnt odor & taste","['roasted', 'nutty', 'cocoa', 'burnt', 'coffee', 'potato']",1.0,1.0,1.0,1.0,0.0,1.0
1380,Isoquinoline,c1ccc2cnccc2c1,1535,119-65-3,"Heavy, sweet, balsamic, herbaceous (anisic,almond) odor","['almond', 'herbal', 'anisic', 'balsamic', 'sweet']",1.0,1.0,0.0,1.0,1.0,1.0
2900,Hexenyl acetoacetate,CC/C=C/CCOC(=O)CC(C)=O,3340,84434-20-8,"Sweet, green, somewhat earthy, heavy green-apple","['green', 'earthy', 'apple', 'sweet']",1.0,1.0,0.0,1.0,1.0,1.0
783,Ethyl mercaptopropionate,CCOC(=O)C(C)S,878,19788-49-9,"Sulfurous, diffusive fruity character on dilution.","['sulfurous', 'fruity']",1.0,1.0,1.0,1.0,1.0,0.0
1158,Hexyl tiglate,C/C=C(\C)C(=O)OCCCCCC,1295,16930-96-4,"Fresh, green, fruity odor","['green', 'fruity', 'fresh']",0.0,-1.0,-1.0,-1.0,-1.0,-1.0
3182,Thenyl alcohol,OCc1cccs1,3694,636-72-6,"Ethereal, ferrmented, burnt, alliaceous, coffee like, slight savory","['ethereal', 'alliaceous', 'savory', 'fermented', 'burnt', 'coffee']",0.0,-1.0,-1.0,-1.0,-1.0,-1.0
375,Cinnamyl phenylacetate,O=C(Cc1ccccc1)OC/C=C/c1ccccc1,433,7492-65-1,"Sweet, balsum-honey-floral odor and a spicy, honey-like taste","['honey', 'balsamic', 'floral', 'sweet']",1.0,0.0,1.0,1.0,1.0,1.0
1566,Methyl methanethiosulfonate,CSS(C)(=O)=O,1756,2949-92-0,"Pungent alliaceous, roasted, cooked onion, durian","['roasted', 'alliaceous', 'onion', 'pungent']",1.0,1.0,1.0,1.0,1.0,0.0
191,Benzyl isothiocyanate,S=C=NCc1ccccc1,222,622-78-6,"Pungent, hot vegetative, radish-horseradish-cress like; papaya note","['radish', 'horseradish', 'vegetable', 'pungent']",0.0,-1.0,-1.0,-1.0,-1.0,-1.0
8,Acetaldehyde di-isobutyl acetal,CC(C)COC(C)OCC(C)C,8,5669-09-0,"Ethereal, green, somewhat alcoholic, fermented","['green', 'fermented', 'alcoholic', 'ethereal']",1.0,1.0,1.0,1.0,0.0,1.0
998,Heptadienol,CC/C=C/C=C/CO,1119,33467-79-7,"Nutty, fatty cheesy odor","['fatty', 'nutty', 'almond', 'cheesy']",1.0,1.0,1.0,1.0,1.0,0.0
670,Dimethylvinylthiazole,C=Cc1sc(C)nc1C,756,65505-18-2,"Characteristic nut-like, meat like liver notes","['nutty', 'meaty']",1.0,1.0,1.0,0.0,1.0,1.0
316,Butylpyridine,CC(C)(C)c1ccncc1,358,3978-81-2,"Green, woody, tobacco leaf, dried bark like; Cigar odor","['green', 'tobacco', 'leafy', 'woody']",1.0,1.0,1.0,1.0,0.0,1.0
961,Geranyl acetoacetate,CC(=O)CC(=O)OC/C=C(\C)CCC=C(C)C,1071,10032-00-5,"Sweet, fruity, overripe, fermented fruit-like applle notes","['apple', 'fruity', 'fermented', 'sweet']",0.0,-1.0,-1.0,-1.0,-1.0,-1.0
1741,Methylhydroxypropyl methylmercaptopropyl sulfide,CC(O)C(C)SC(C)C(C)S,1941,54957-02-7,"Sulfureous, roasted-meaty with burnt, brothy savory notes; liver","['meaty', 'roasted', 'savory', 'burnt', 'brothy', 'sulfurous']",1.0,1.0,0.0,1.0,1.0,1.0
3123,Vertoliff,CC1=CCC(C)C(C=O)C1,3619,67801-65-4,"Green, Citrus, Herbal, Aldehydic","['green', 'aldehydic', 'citrus', 'herbal']",1.0,1.0,0.0,1.0,1.0,1.0
1655,Methylbutenol,C/C=C(\C)CO,1851,4675-87-0,"Fruity, alcoholic, winey, green-herbal-earthy","['alcoholic', 'green', 'fruity', 'earthy', 'herbal', 'winey']",1.0,0.0,1.0,1.0,1.0,1.0
3031,Propyl sorbate,C/C=C\C=C\C(=O)OCCC,3491,10297-72-0,"Fresh, green, fruity tropical, pineapple","['green', 'fruity', 'tropical', 'fresh', 'pineapple']",1.0,1.0,1.0,1.0,1.0,0.0
517,Diethyl oxalate,CCOC(=O)C(=O)OCC,591,95-92-1,"Weak fermented musky winey, fruity, herbaceous","['fruity', 'musk', 'fermented', 'herbal', 'winey']",0.0,-1.0,-1.0,-1.0,-1.0,-1.0
2042,Pentanal diethyl acetal,CCCCC(OCC)OCC,2288,3658-79-5,"Ethereal, green, fruity, cognac-apple notes","['apple', 'ethereal', 'green', 'fruity', 'cognac']",1.0,1.0,1.0,1.0,1.0,0.0
1915,Nonadienol,CCC=CCCC=CCO,2142,7786-44-9,"Powerful, cucumber, melon, leafy-vegetable odor and taste","['leafy', 'vegetable', 'cucumber', 'melon']",1.0,1.0,1.0,0.0,1.0,1.0
1080,Hexenal,CC/C=C/CC=O,1206,4440-65-7,"Strong, pungent, fresh green-grass odor; green tomato like","['grassy', 'apple', 'green', 'fresh', 'tomato', 'leafy', 'pungent']",1.0,0.0,1.0,1.0,1.0,1.0
944,Furfuryl pentanoate,CCCCC(=O)OCc1ccco1,1051,36701-01-6,"Fruity-pineapple-apple, caramellic odor; ripe pineapple-apple fruity taste","['fruity', 'apple', 'caramellic', 'pineapple']",1.0,1.0,1.0,1.0,1.0,0.0
943,Furfuryl octanoate,CCCCCCCC(=O)OCc1ccco1,1050,39252-03-4,"Sweet, coconut-peach like odor; milky, cheese, waxy, cream fruity","['peach', 'coconut', 'sweet']",1.0,1.0,1.0,1.0,1.0,0.0
1477,Methionine,CSCC[C@H](N)C(=O)O,1659,63-68-3,Used in reaction flavors to produce meaty aromas,['meaty'],1.0,0.0,1.0,1.0,1.0,1.0
2811,Cyclohexylethyl formate,O=COCCC1CCCCC1,3227,6282-05-9,"Strong, estry, fruity with apple & waxy notes","['fruity', 'apple', 'waxy']",1.0,1.0,1.0,0.0,1.0,1.0
112,Allyl tiglate,C=CCOC(=O)/C(C)=C/C,130,7493-71-2,"Sweet, green-herbaceous, earthy, fruity berry odor and taste","['green', 'earthy', 'fruity', 'berry', 'herbal', 'sweet']",1.0,1.0,0.0,1.0,1.0,1.0
257,Butyl butenoate,CC=CC(=O)OCCCC,293,591-63-9,"Fruity, green, herbal, pineapple, rum, cognac, apple in dilution","['apple', 'green', 'fruity', 'cognac', 'herbal', 'pineapple', 'rum']",0.0,-1.0,-1.0,-1.0,-1.0,-1.0
3419,Diisopropyl adipate,CC(C)OC(=O)CCCCC(=O)OC(C)C,4080,6938-94-9,"Mild, faint fruity",['fruity'],1.0,1.0,1.0,1.0,1.0,0.0
1310,Isoeugenyl phenylacetate,C/C=C/c1ccc(OC(=O)Cc2ccccc2)c(OC)c1,1460,120-24-1,"Sweet, vanilla-honey-clove odor; spicy, honey, fruity taste","['honey', 'vanilla', 'sweet']",1.0,1.0,1.0,0.0,1.0,1.0
3216,Phenylacetaldehyde ethyleneglycol acetal,c1ccc(CC2OCCO2)cc1,3740,101-49-5,"Green, waxy, sweet, hyacinth; slightly reminiscent of rhubarb","['green', 'waxy', 'sweet']",1.0,0.0,1.0,1.0,1.0,1.0
1694,Methylcyclopentenone,CC1=CC(=O)CC1,1890,2758-18-1,"Sweet, caramellic, ketonic and somewhat chemical notes","['ketonic', 'caramellic', 'sweet']",1.0,0.0,1.0,1.0,1.0,1.0
3227,Hydroxypropyl phenylacetate,CC(O)COC(=O)Cc1ccccc1,3759,80550-09-0,"Mild, balsamic honey notes","['honey', 'balsamic']",1.0,1.0,0.0,1.0,1.0,1.0
2403,Tridecenol,CCCCCCCCCC/C=C/CO,2712,68480-25-1,"Mild, persistent waxy, slight citrusy odor","['waxy', 'citrus']",1.0,1.0,1.0,1.0,1.0,0.0
2630,Phenylmethylhexenal,CCCC=C(C=O)Cc1ccccc1,3002,26643-92-5,"Floral, phenylacetaldehyde-like odor; cocoa-chocolate taste",['floral'],1.0,1.0,1.0,1.0,0.0,1.0
1654,Methylbutenol,C=CC(C)(C)O,1850,115-18-4,"Ethereal, oily-fruity, herbaceous-earthy","['ethereal', 'earthy', 'oily', 'fruity', 'herbal']",1.0,0.0,1.0,1.0,1.0,1.0
386,Citronellol,CC(C)=CCC[C@H](C)CCO,444,7540-51-4,"Floral, rose, sweet, green with fruity citrus nuances","['rose', 'citrus', 'green', 'fruity', 'floral', 'sweet']",1.0,1.0,1.0,1.0,1.0,0.0
533,Diethylthiazole,CCc1cnc(CC)s1,607,15729-76-7,"Musty, nutty, meaty, green peppery","['nutty', 'musty', 'meaty']",1.0,1.0,0.0,1.0,1.0,1.0
683,Dodecadienal,CCCCCCC/C=C/C=C/C=O,773,21662-16-8,"Strong, fatty, fried meat, tallow with orange & grapefruit notes","['meaty', 'fatty', 'orange', 'grapefruit']",1.0,1.0,1.0,1.0,0.0,1.0
831,Ethyl propyl sulfide,CCCSCC,927,4110-50-3,"Cooked vegetable; corn, onion and seafood notes","['onion', 'vegetable']",0.0,-1.0,-1.0,-1.0,-1.0,-1.0
215,Bisfurfuryl sulfide,c1coc(CSCc2ccco2)c1,246,13678-67-6,"Roasted, earthy mushroom, burnt, coffee, meaty odor, savory","['roasted', 'meaty', 'earthy', 'savory', 'burnt', 'coffee', 'mushroom']",1.0,1.0,1.0,0.0,1.0,1.0
2041,Pentadienal,C=C/C=C\C=O,2286,764-40-9,"Green, pungent, spicy-acrylic like odor; anchovy like at 2-10 ppm","['spicy', 'green', 'pungent']",1.0,1.0,1.0,1.0,1.0,0.0
3024,Phenylpropyl valerate,CCCCC(=O)OCCCc1ccccc1,3481,5451-88-7,"Heavy-fruity, mildly spicy-balsamic, sweet, reminiscent of fruit preserves","['spicy', 'fruity', 'balsamic', 'sweet']",1.0,0.0,1.0,1.0,1.0,1.0
142,Amylcinnamyl acetate,CCCCCC(/C=C/c1ccccc1)OC(C)=O,168,7493-78-9,"Mild, fruity, spicy, balsamic, floral odor & a somewhat fruity taste","['floral', 'fruity', 'spicy', 'balsamic']",1.0,1.0,1.0,1.0,0.0,1.0
3316,Glycolic acid,O=C(O)CO,3922,79-14-1,"Nearly odorless, acidic tart taste (see comments)",['odorless'],1.0,1.0,1.0,0.0,1.0,1.0
3390,Ethylmethylmethylpropylthiazoline,CCCS1=C(C)N(C)C(CC)C1,4019,83418-53-5,"Roasted, chocolate-like, nutty, vegetable-like","['chocolate', 'vegetable', 'nutty', 'roasted']",1.0,1.0,1.0,1.0,0.0,1.0
1982,Octanedithiol,SCCCCCCCCS,2214,1191-62-4,"Sulfuraceous; meaty-earthy-mushroom odor, fatty-meaty flavor in dilution","['earthy', 'sulfurous', 'meaty', 'mushroom']",1.0,0.0,1.0,1.0,1.0,1.0
2248,Propylanisole,CCCc1ccc(OC)cc1,2507,104-45-0,"Sweet, herbaceous, anise-fennel, licorice odor and taste","['herbal', 'anisic', 'sweet']",0.0,-1.0,-1.0,-1.0,-1.0,-1.0
3307,Oxodecanoic acid,CCCCCC(=O)CCCC(=O)O,3912,624-01-1,Creamy. peach; Precursor of delta-decalactone by microorganisms.,"['creamy', 'peach']",1.0,1.0,1.0,1.0,0.0,1.0
3025,Propyl acetoacetate,CCCOC(=O)CC(C)=O,3485,1779-60-8,"Fruity, caramellic, fermented, brandy, heavy fruit-apple notes","['apple', 'caramellic', 'fruity', 'fermented', 'brandy']",0.0,-1.0,-1.0,-1.0,-1.0,-1.0
237,Butanone,CCC(C)=O,271,78-93-3,"Sweet, solvent, acetone-like ketonic odor; fruity camphor odor","['ketonic', 'solvent', 'fruity', 'camphoreous', 'sweet']",1.0,0.0,1.0,1.0,1.0,1.0
2130,Phenylpentanol,OCCCCCc1ccccc1,2379,10521-91-2,"Sweet, floral, carnation, herbaceous-citrus odor","['citrus', 'herbal', 'floral', 'sweet']",1.0,0.0,1.0,1.0,1.0,1.0
3329,Menthadienol,C=C1CC[C@@H](C(=C)C)C[C@@H]1O,3940,21391-84-4,"Herbaceous, citrus, minty","['mint', 'citrus', 'herbal']",1.0,1.0,1.0,1.0,0.0,1.0
1877,Monosodium glutamate,N[C@@H](CCC(=O)O)C(=O)O,2093,142-47-2,"Faint, meat-like odor; sweet-salty umami ""meaty"" taste",['meaty'],1.0,1.0,1.0,0.0,1.0,1.0
676,Dipropyl malonate,CCCOC(=O)CC(=O)OCCC,762,1117-19-7,"Weak ethereal, apple, fruity-winey","['fruity', 'apple', 'winey', 'ethereal']",0.0,-1.0,-1.0,-1.0,-1.0,-1.0
2228,Propyl gallate,CCCOC(=O)c1cc(O)c(O)c(O)c1,2487,121-79-9,Almost odorless when pure,['odorless'],1.0,1.0,1.0,0.0,1.0,1.0
1629,Methylacetylpyrrole,CC(=O)c1cccn1C,1821,932-16-1,"Weak, sweet, floral nutty notes","['nutty', 'floral', 'sweet']",1.0,1.0,1.0,1.0,1.0,0.0
959,Geraniol,CC(C)=CCC/C(C)=C/CO,1069,106-24-1,"Sweet, floral, rose-like odor; fruity taste","['rose', 'floral', 'sweet']",1.0,1.0,1.0,1.0,1.0,0.0
1433,Menthadienyl acetate,C=C(COC(C)=O)C1CC=C(C)CC1,1601,15111-97-4,"Sweet, fruity, herbaceous, slight woody odor","['woody', 'fruity', 'sweet', 'herbal']",1.0,0.0,1.0,1.0,1.0,1.0
2595,Methyl octenoate,CC/C=C\CCCC(=O)OC,2960,41654-15-3,"Vegetable, dairy, fruity, green, coconut, tropical","['green', 'fruity', 'coconut', 'tropical', 'dairy', 'vegetable']",1.0,1.0,1.0,1.0,1.0,0.0
969,Geranyl linalool,C=CC(C)(O)CC/C=C(\C)CC/C=C(\C)CCC=C(C)C,1079,1113-21-9,"Mild, floral (rose), balsamic, sweet","['balsamic', 'floral', 'rose', 'sweet']",1.0,0.0,1.0,1.0,1.0,1.0
1361,Isopropylcyclohexanol,CC(C)C1CCC(O)CC1,1513,4621-04-9,"Diffusive floral notes reminiscent of lilac, rose and geranium","['floral', 'rose']",0.0,-1.0,-1.0,-1.0,-1.0,-1.0
1179,Hydroxycitronellal,CC(CC=O)CCCC(C)(C)O,1319,107-75-5,"Sweet, floral, lily-type odor; sweet waxy green, floral taste & melon note","['floral', 'sweet']",0.0,-1.0,-1.0,-1.0,-1.0,-1.0
2397,Tridecalactone,CCCCCCCCC1CCCC(=O)O1,2705,7370-92-5,"Fatty, creamy, dairy-butter notes","['buttery', 'fatty', 'dairy', 'creamy']",0.0,-1.0,-1.0,-1.0,-1.0,-1.0
447,Decanal diethyl acetal,CCCCCCCCCC(OCC)OCC,513,34764-02-8,"Fresh citrusy, herbal-oily-fruity, fatty-waxy, ethereal rum note","['citrus', 'ethereal', 'oily', 'fruity', 'fatty', 'fresh', 'waxy', 'herbal', 'rum']",0.0,-1.0,-1.0,-1.0,-1.0,-1.0
2824,Dimethyl benzyl carbinyl crotonate,C/C=C/C(=O)OC(C)(C)Cc1ccccc1,3249,93762-34-6,"Warm, herbaceous, heavy fruity, spicy","['fruity', 'spicy', 'warm', 'herbal']",0.0,-1.0,-1.0,-1.0,-1.0,-1.0
1635,Methylbenzoxazole,Cc1nc2ccccc2o1,1828,95-21-6,"Sweet, pungent, tobacco, burnt, floral-vanilla, heavy notes","['tobacco', 'vanilla', 'pungent', 'burnt', 'floral', 'sweet']",1.0,0.0,1.0,1.0,1.0,1.0
597,Dimethylcyclopentadione,CC1CC(=O)C(=O)C1C,680,13494-06-9,"Strong maple, burnt-sugar, caramel odor/taste; cyclotene-like","['caramellic', 'burnt']",1.0,1.0,1.0,1.0,1.0,0.0
3280,Ethyl pentanethioate,CCCCC(=S)OCC,3859,2432-92-0,"Strong, cheesy, fruity","['fruity', 'cheesy']",1.0,0.0,1.0,1.0,1.0,1.0
1578,Methyl methylthioacetate,COC(=O)CSC,1768,16630-66-3,"Sulfurous, vegetative, meat, cheese, savory, tropical fruity in dilution","['vegetable', 'meaty', 'fruity', 'savory', 'tropical', 'sulfurous', 'cheesy']",1.0,1.0,1.0,0.0,1.0,1.0
889,Ethyloctanoic acid,CCCC[C@@H](CC)CCC(=O)O,989,16493-80-4,Powerful goaty odor; costus root like with dairy cheese notes,"['dairy', 'cheesy']",0.0,-1.0,-1.0,-1.0,-1.0,-1.0
2906,Hexenyl hexanoate,CCC/C=C\COC(=O)CCCCC,3346,56922-79-3,"Strong, fruity-green, apple-pear-like","['green', 'fruity', 'apple', 'pear']",1.0,1.0,1.0,0.0,1.0,1.0
3149,Ditolyl disulfide,Cc1ccccc1SSc1ccccc1C,3650,4032-80-8,"Sulfury, roasted, burnt, meaty","['sulfurous', 'burnt', 'meaty', 'roasted']",1.0,0.0,1.0,1.0,1.0,1.0
1661,Methylbutyl acetate,CCCC(C)OC(C)=O,1857,626-38-0,"Fruity, ripe, banana creamy, green taste at 10 ppm","['ripe', 'fruity']",0.0,-1.0,-1.0,-1.0,-1.0,-1.0
126,Amyl furoate,CCCCCOC(=O)c1ccco1,152,1334-82-3,"Sweet, fruity, caramellic, herbaceous, winey, fermented odor & flavor","['caramellic', 'fruity', 'fermented', 'herbal', 'winey', 'sweet']",1.0,1.0,1.0,1.0,1.0,0.0
2023,Octyl phenylacetate,CCCCCCCCOC(=O)Cc1ccccc1,2258,122-45-2,"Sweet floral-rose, slight fatty, citrus-like; mild fruity notes","['rose', 'citrus', 'fatty', 'fruity', 'floral', 'sweet']",1.0,1.0,1.0,1.0,0.0,1.0
1842,Methylthiobutanone,CCC(=O)CSC,2054,13678-58-5,Odor reminiscent of mushroom with a garlic undertone,"['garlic', 'mushroom']",1.0,1.0,0.0,1.0,1.0,1.0
885,Ethylmethylthiazole,CCc1csc(C)n1,985,32272-48-3,"Sulfurous, meaty, roasted, greenish notes","['green', 'sulfurous', 'roasted', 'meaty']",1.0,1.0,1.0,1.0,0.0,1.0
2586,Hexyl mercaptobutanoate,CCCCCCOC(=O)C(S)CC,2948,796857-79-9,"Green-herbaceous, tropical fruit, mango, passion fruit, grapefruit","['green', 'fruity', 'tropical', 'herbal', 'grapefruit']",1.0,1.0,1.0,0.0,1.0,1.0
963,Geranyl butyrate,CCCC(=O)OC/C=C(\C)CCC=C(C)C,1073,106-29-6,"Sweet, fruity, rose-like odor; fruity, heavy apricot-tropical like taste","['fruity', 'rose', 'sweet']",1.0,1.0,1.0,0.0,1.0,1.0
341,Carveol,C=C(C)C1CC=C(C)C(O)C1,393,99-48-9,Caraway-like; sweet spearmint-like odor,['sweet'],1.0,1.0,0.0,1.0,1.0,1.0
1079,Hexenal,CCC/C=C/C=O,1205,505-57-7,"Strong, leafy-green, fruity, pungent, apple, vegetable-like odor","['grassy', 'apple', 'green', 'fruity', 'fresh', 'leafy', 'vegetable', 'pungent']",1.0,1.0,0.0,1.0,1.0,1.0
1066,Hexanedione,CCCC(=O)C(C)=O,1192,3848-24-6,"Creamy, sweet buttery odor & butter-cheese, fruity, caramellic taste","['creamy', 'sweet', 'buttery']",1.0,1.0,1.0,0.0,1.0,1.0
1173,Hydroxybenzyl methyl ether,COCc1ccc(O)cc1,1313,5355-17-9,"Weak, sweet, somewhat green, slightly earthy, phenolic, medicinal","['green', 'earthy', 'phenolic', 'medicinal', 'sweet']",1.0,1.0,1.0,0.0,1.0,1.0
2091,Phenethyl lactate,O=C(CCO)OCCc1ccccc1,2340,10138-63-3,"Bland, sweet fruity-ethereal; used to mellow flavors","['fruity', 'sweet', 'ethereal']",1.0,1.0,1.0,0.0,1.0,1.0
1035,Heptyl cinnamate,CCCCCCCOC(=O)/C=C/c1ccccc1,1160,10032-08-3,"Floral, green, somewhat earthy odor; floral-green fruity flavor","['green', 'earthy', 'floral']",1.0,1.0,1.0,1.0,1.0,0.0
762,Ethyl geranyl ether,CCOC/C=C(\C)CCC=C(C)C,855,40267-72-9,"Flowery odor (Aster), Light spicy, natural flowery green, rose-like odor","['spicy', 'rose', 'green', 'floral']",0.0,-1.0,-1.0,-1.0,-1.0,-1.0
1182,Hydroxydecadienoic acid lactone,CCCCCc1cccc(=O)o1,1322,27593-23-3,"Powerful coconut, peach, creamy-buttery, dairy odor & flavor","['creamy', 'coconut', 'dairy', 'peach', 'buttery']",1.0,1.0,1.0,1.0,1.0,0.0
2739,Methoxydimethylpyrazine,COc1cnc(C)c(C)n1,3141,,"Earthy, musty, moldy odor","['earthy', 'musty']",1.0,1.0,0.0,1.0,1.0,1.0
220,Bornyl acetate,CC(=O)O[C@@H]1C[C@@H]2CC[C@@]1(C)C2(C)C,251,5655-61-8,"Pine-needle aroma, sweet herbaceous, slight balsamic","['pine', 'balsamic', 'sweet', 'herbal']",1.0,1.0,1.0,0.0,1.0,1.0
746,Ethyl decanoate,CCCCCCCCCC(=O)OCC,837,110-38-3,"Sweet, fatty, nut-like, winey-cognac odor","['fatty', 'nutty', 'cognac', 'winey', 'sweet']",1.0,1.0,1.0,0.0,1.0,1.0
1234,Isoamyl octanoate,CCCCCCCC(=O)OCCC(C)C,1377,2035-99-6,"Oily, fruity, somewhat winey-cognac; waxy-fatty, green pineapple notes","['green', 'oily', 'fruity', 'fatty', 'waxy', 'cognac', 'winey', 'pineapple']",1.0,1.0,1.0,0.0,1.0,1.0
3309,Oxooctanoic acid,CCCC(=O)CCCC(=O)O,3914,3637-14-7,Fruity; Precursor of delta-octalactone by microorganisms.,['fruity'],1.0,0.0,1.0,1.0,1.0,1.0
3297,Octenone,C=CCCCCC(C)=O,3893,3664-60-6,"Cheesy, herbaceous, fatty","['fatty', 'herbal', 'cheesy']",1.0,1.0,0.0,1.0,1.0,1.0
