,chemical_name,smiles,database_id,cas,odor_data,odor_labels_filtered,labels_trainAndtest,labels_cv0,labels_cv1,labels_cv2,labels_cv3,labels_cv4
2439,Tyramine,NCCc1ccc(O)cc1,2752,51-67-2,"Phenolic, amine, smoked fishy note, adds to ripe cheese notes","['ripe', 'fishy', 'phenolic', 'cheesy']",1.0,1.0,0.0,1.0,1.0,1.0
1293,Isobutylmethylpyrazine,Cc1nccnc1CC(C)C,1440,13925-06-9,"Powerful herbaceous, vegetative, green pepper, earthy notes","['earthy', 'vegetable', 'herbal']",0.0,-1.0,-1.0,-1.0,-1.0,-1.0
2315,"Tartaric acid (d-, l-, dl-, meso)",O=C(O)C(O)C(O)C(=O)O,2614,133-37-9,Odorless with a strong tart acid taste,['odorless'],1.0,0.0,1.0,1.0,1.0,1.0
673,Diphenyl ether,c1ccc(Oc2ccccc2)cc1,759,101-84-8,"Floral-green, metallic geranium odor","['green', 'floral', 'metallic']",0.0,-1.0,-1.0,-1.0,-1.0,-1.0
2647,"Acetaldehyde 2,3-butanediol acetal",CC1OC(C)C(C)O1,3027,3299-32-9,"Fresh ethereal, green, alcoholic, winey-fruity","['alcoholic', 'ethereal', 'green', 'fruity', 'fresh', 'winey']",1.0,1.0,1.0,0.0,1.0,1.0
183,Benzyl decanoate,CCCCCCCCCC(=O)OCc1ccccc1,214,42175-41-7,"Faint fatty-waxy, slightly floral","['floral', 'fatty', 'waxy']",1.0,1.0,1.0,1.0,0.0,1.0
3356,Mint sulfide,C=C1CC[C@@H]2S[C@@H]1[C@H]1[C@H](C(C)C)CC[C@@]21C,3973,72445-42-2,"Heavy, woody musty-earthy odor","['earthy', 'woody', 'musty']",0.0,-1.0,-1.0,-1.0,-1.0,-1.0
1756,Methylnaphthalene,Cc1ccc2ccccc2c1,1959,91-57-6,"Oily, aromatic at 1ppm in sugar syrup.","['oily', 'aromatic']",1.0,1.0,1.0,1.0,1.0,0.0
1141,Hexyl formate,CCCCCCOC=O,1278,629-33-4,"Sweet, ethereal, green-unripe fruity odor; fruity-green apple like taste","['ethereal', 'green', 'fruity', 'sweet']",1.0,0.0,1.0,1.0,1.0,1.0
2281,Rhodinyl isovalerate,C=C(C)CCCC(C)CCOC(=O)CC(C)C,2554,7778-96-3,"Heavy fruity, rose floral odor; sweet woody, rose-fruity taste","['fruity', 'floral', 'rose']",1.0,1.0,0.0,1.0,1.0,1.0
2277,Rhodinyl acetate,C=C(C)CCCC(C)CCOC(C)=O,2550,141-11-7,"Fresh rosy, fruity odor; fruity-berry like taste","['fruity', 'fresh', 'rose']",0.0,-1.0,-1.0,-1.0,-1.0,-1.0
271,Butyl hexadecanoate,CCCCCCCCCCCCCCCC(=O)OCCCC,307,111-06-8,Mild fatty-waxy; adds mouthfeel,"['fatty', 'waxy']",1.0,1.0,1.0,1.0,1.0,0.0
813,Ethyl octenoate,CCC/C=C\CCC(=O)OCC,909,34495-71-1,"Fruity, fatty, green, pineapple, pear","['green', 'fruity', 'fatty', 'pear', 'pineapple']",1.0,0.0,1.0,1.0,1.0,1.0
1407,Linalyl anthranilate,C=CC(C)(CCC=C(C)C)OC(=O)c1ccccc1N,1566,7149-26-0,"Green, floral, mandarin, orange blossom  odor & similar taste","['green', 'orange', 'floral']",0.0,-1.0,-1.0,-1.0,-1.0,-1.0
3412,Dipropenylsulfide,C/C=C/S/C=C/C,4068,65819-74-1,"Pungent savory, onion-garlic odor and taste","['onion', 'garlic', 'pungent', 'savory']",1.0,0.0,1.0,1.0,1.0,1.0
2683,Methyloctanal,CCC(C)CCCCC=O,3068,30689-75-9,"Powerful, sweet, green, fatty, citrus, orange-like","['citrus', 'green', 'fatty', 'orange', 'sweet']",1.0,1.0,0.0,1.0,1.0,1.0
644,Dimethylpropylthiazole,CCCc1nc(C)c(C)s1,729,41981-72-0,"Roasted, nutty, green, cocoa, tropical fruity","['roasted', 'green', 'fruity', 'nutty', 'cocoa', 'tropical']",1.0,1.0,0.0,1.0,1.0,1.0
3170,Catechol diethyl ether,CCOc1ccccc1OCC,3674,2050-46-6,"Mild, sweet vanilla like odor, slightly anisic","['anisic', 'vanilla', 'sweet']",1.0,1.0,1.0,1.0,1.0,0.0
1680,Methylbutyric acid,CCC(C)C(=O)O,1876,116-53-0,"Pungent, acrid, roquefort cheese like; fruity in dilution","['fruity', 'pungent', 'cheesy']",0.0,-1.0,-1.0,-1.0,-1.0,-1.0
57,Acetylethylpyrazine,CCc1cncc(C(C)=O)n1,64,34413-34-8,"Nutty, popcorn, hazelnut","['nutty', 'hazelnut', 'popcorn']",1.0,1.0,1.0,0.0,1.0,1.0
632,Dimethyloctenone,CCCCC=CC(=O)C(C)C,717,2550-18-7,"Herbaceous, fresh, ketonic, slight fruity","['ketonic', 'fruity', 'fresh', 'herbal']",0.0,-1.0,-1.0,-1.0,-1.0,-1.0
2679,Heptadecane,CCCCCCCCCCCCCCCCC,3064,629-78-7,Weak waxy hydrocabon odor,"['waxy', 'gasoline']",1.0,1.0,0.0,1.0,1.0,1.0
1890,Myrtenyl isovalerate,CC(C)CC(=O)OCC1=CCC2CC1C2(C)C,2108,33900-84-4,"Herbaceous, woody, fruity, valerian","['woody', 'fruity', 'herbal']",1.0,1.0,1.0,1.0,1.0,0.0
1981,Octanedione,CCCC(=O)C(=O)CCC,2213,5455-24-3,"sweet fatty buttery with creamy, caramelic, fruity, cheese notes","['creamy', 'caramellic', 'fatty', 'fruity', 'cheesy', 'sweet', 'buttery']",1.0,1.0,1.0,1.0,0.0,1.0
2496,Decenyl acetate,CCCCC/C=C\CCCOC(C)=O,2820,67452-27-1,"Fruity, waxy fatty floral-rose with spice & estery, herbaceous-citrus note","['rose', 'citrus', 'fruity', 'fatty', 'waxy', 'herbal', 'floral']",1.0,1.0,1.0,0.0,1.0,1.0
588,Dimethylbenzaldehyde,Cc1ccc(C=O)c(C)c1,671,15764-16-6,"Sweet, bitter almond, cherry like aroma and taste","['cherry', 'almond', 'sweet']",1.0,1.0,1.0,1.0,1.0,0.0
3043,Amyl acetate,CCC(C)(C)OC(C)=O,3515,625-16-1,"Fresh-minty, fruity banana odor","['fruity', 'fresh', 'banana', 'mint']",1.0,1.0,1.0,1.0,0.0,1.0
3353,Dipentyl disulfide,CCCCCSSCCCCC,3970,112-51-6,"Sulfurous; allium, savory, meaty, green, vegetative","['vegetable', 'meaty', 'green', 'alliaceous', 'savory', 'sulfurous']",1.0,1.0,1.0,1.0,0.0,1.0
1936,Nonanone,CCCCCC(=O)CCC,2164,4485-09-0,"Herbaceous, grassy, green, fruity, oily","['grassy', 'green', 'fruity', 'oily', 'herbal']",1.0,1.0,1.0,1.0,1.0,0.0
1419,Linolenic acid,CC/C=C/C/C=C/C/C=C/CCCCCCCC(=O)O,1578,463-40-1,Fatty (see comments),['fatty'],0.0,-1.0,-1.0,-1.0,-1.0,-1.0
1250,Isobutanal diisopentyl acetal,CC(C)CCOC(OCCC(C)C)C(C)C,1397,13112-63-5,"Ethereal, green, somewhat alcoholic, malty-cocoa, fermented","['alcoholic', 'ethereal', 'malty', 'green', 'cocoa', 'fermented']",1.0,1.0,1.0,1.0,1.0,0.0
2764,Allyl methylbutoxyacetate,C=CCOC(=O)COCC(C)CC,3172,67634-01-9,"Green-herbaceous-galbanum, fruity","['green', 'fruity', 'herbal']",1.0,0.0,1.0,1.0,1.0,1.0
1934,Nonanone,CCCCCCCC(C)=O,2162,821-55-6,"Fruity, fatty-cheese-herbal-coconut odor; fruity dairy-cheese taste","['fruity', 'fatty', 'coconut', 'herbal', 'cheesy']",1.0,0.0,1.0,1.0,1.0,1.0
261,Butyl cinnamate,CCCCOC(=O)/C=C/c1ccccc1,297,538-65-8,"Sweet, balsamic, fruity-cocoa notes","['fruity', 'balsamic', 'cocoa', 'sweet']",1.0,1.0,1.0,1.0,1.0,0.0
2264,Pyrazine,c1cnccn1,2526,290-37-9,"Musty, raw nut like, corn-like, roasted hazelnuts","['roasted', 'nutty', 'musty']",1.0,0.0,1.0,1.0,1.0,1.0
1381,Isovaleraldehyde di-isobutyl acetal,CC(C)COC(CC(C)C)OCC(C)C,1536,13439-98-0,"Green, somewhat alcoholic, malty-cocoa, fermented","['alcoholic', 'malty', 'green', 'cocoa', 'fermented']",1.0,1.0,1.0,1.0,1.0,0.0
1706,Methylfuranone,CC1OC=CC1=O,1904,41763-99-9,"Sweet, roasted, caramellic, nutty-bread ike, somewhat buttery","['caramellic', 'roasted', 'nutty', 'bread', 'sweet', 'buttery']",1.0,1.0,1.0,0.0,1.0,1.0
805,Ethyl methylthiopropionate,CCOC(=O)CCSC,901,13327-56-5,"Fruity, caramelized pineapple odor; pineapple taste; milky, cheese notes","['fruity', 'caramellic', 'pineapple']",0.0,-1.0,-1.0,-1.0,-1.0,-1.0
1976,Octalactone,CCCC1CCCC(=O)O1,2208,698-76-0,"Coumarinic, coconut odor, creamy, coconut flesh taste","['coconut', 'coumarinic']",1.0,0.0,1.0,1.0,1.0,1.0
440,Damascone,C/C=C/C(=O)C1C(C)C=CCC1(C)C,506,57378-68-4,"Rosy, fruity (black currant) odor (See comments)","['black currant', 'fruity', 'rose']",1.0,1.0,1.0,1.0,0.0,1.0
1359,Isopropylamine,CC(C)N,1511,75-31-0,"Fishy amine-like, slightly cheesy on dilution","['fishy', 'cheesy']",1.0,1.0,0.0,1.0,1.0,1.0
2104,Phenoxyethyl isobutyrate,CC(C)C(=O)OCCOc1ccccc1,2353,103-60-6,"Fruity, floral-honey-like odor; fruity waxy apple-chamomile like taste","['honey', 'fruity', 'floral']",0.0,-1.0,-1.0,-1.0,-1.0,-1.0
2786,Benzyl nonanoate,CCCCCCCCC(=O)OCc1ccccc1,3195,6471-66-5,"Weak sweet, fresh-balsamic-floral, slightly fatty odor","['fatty', 'fresh', 'balsamic', 'floral', 'sweet']",1.0,1.0,0.0,1.0,1.0,1.0
619,Dimethylisobutylthiazoline,CC1=NC(CC(C)C)SC1C,702,65894-83-9,"Sweet, roasted, meat, nut, burnt corn, chocolate; green vegetable notes","['meaty', 'roasted', 'green', 'nutty', 'burnt', 'vegetable', 'sweet', 'chocolate']",0.0,-1.0,-1.0,-1.0,-1.0,-1.0
1288,Isobutylamine,CC(C)CN,1435,78-81-9,"Fishy, ammoniacal, shellfish, malty, ripe cheese notes","['ripe', 'malty', 'fishy', 'cheesy']",1.0,1.0,1.0,1.0,0.0,1.0
94,Allyl isovalerate,C=CCOC(=O)CC(C)C,112,2835-39-4,"Powerful, winey-fruity, overripe apple, berry-cherry-like odor/taste","['apple', 'cherry', 'fruity', 'berry', 'winey']",1.0,1.0,0.0,1.0,1.0,1.0
157,Anisyl phenylacetate,COc1ccc(COC(=O)Cc2ccccc2)cc1,183,102-17-0,"Weak balsamic, rosy odor with honey notes; honey-balsamic taste","['honey', 'balsamic', 'rose']",0.0,-1.0,-1.0,-1.0,-1.0,-1.0
3197,Monoglyme,COCCOC,3712,110-71-4,"Sweet, ethereal-solvent-like odor","['solvent', 'sweet', 'ethereal']",1.0,1.0,0.0,1.0,1.0,1.0
1075,Hexanone,CCCC(=O)CC,1201,589-38-8,"Grape, wine-like, ethereal odor; fruity. waxy, somewhat rummy flavor","['grape', 'winey', 'ethereal']",1.0,1.0,1.0,1.0,1.0,0.0
3132,Methylmethylthiomethylhexenal,CSC/C(C=O)=C/CC(C)C,3629,85407-25-6,"Powerful onion meat to soup-like aroma, spicy, herbal","['spicy', 'meaty', 'onion', 'herbal']",1.0,1.0,1.0,0.0,1.0,1.0
1608,Methyl propionate,CCC(=O)OC,1800,554-12-1,"Ethereal, fruity, rum-like odor; sweet fruity taste","['fruity', 'ethereal', 'rum']",0.0,-1.0,-1.0,-1.0,-1.0,-1.0
2910,Hexenyl nonanoate,CCCCC=COC(=O)CCCCCCCC,3350,88191-46-2,"Herbal-green, waxy, oily, fruity","['green', 'oily', 'fruity', 'waxy', 'herbal']",1.0,1.0,0.0,1.0,1.0,1.0
363,Cinnamaldehyde ethylene glycol acetal,C(=C/C1OCCO1)\c1ccccc1,421,5660-60-6,"Pleasant, spicy, sweet, cinnamon-like; cinnamon-allspice taste","['cinnamon', 'spicy', 'sweet']",0.0,-1.0,-1.0,-1.0,-1.0,-1.0
3381,Perillaldehyde,C=C(C)[C@@H]1CC=C(C=O)CC1,4003,18031-40-8,"Spicy, fatty, herbaceous with perilla, cumin and dill notes","['spicy', 'fatty', 'herbal']",1.0,1.0,1.0,0.0,1.0,1.0
1165,Hexylpyridine,CCCCCCc1ccccn1,1302,1129-69-7,"Green, vegetable, nutty, fatty, mutton notes","['green', 'fatty', 'nutty', 'vegetable']",0.0,-1.0,-1.0,-1.0,-1.0,-1.0
173,Benzophenone,O=C(c1ccccc1)c1ccccc1,204,119-61-9,"Rose-like, geranium-like odor",['rose'],1.0,1.0,1.0,1.0,0.0,1.0
3502,Dimethylcyclopentenone,CC1=C(C)C(=O)CC1,4282,1121-05-7,"Ketonic, burnt, somewhat caramellic fruity & roasted","['ketonic', 'caramellic', 'roasted', 'fruity', 'burnt']",1.0,1.0,1.0,1.0,0.0,1.0
2419,Trimethylhexanal,CC(CC=O)CC(C)(C)C,2731,5435-64-3,"Strong-green, herbal, spicy odor","['green', 'spicy', 'herbal']",1.0,0.0,1.0,1.0,1.0,1.0
1754,Methylmethylthiopyrazine,CSc1cncc(C)n1,1957,2884-13-1,"Roasted nut, burnt, meaty","['nutty', 'burnt', 'meaty', 'roasted']",1.0,1.0,1.0,1.0,0.0,1.0
3432,Hexenoic acid,CC/C=C\CC(=O)O,4099,1775-43-5,"Green, grass, fruity, cheesy, melon","['grassy', 'green', 'fruity', 'melon', 'cheesy']",1.0,1.0,1.0,1.0,0.0,1.0
2367,Thiophenecarbaldehyde,O=Cc1cccs1,2671,98-03-3,"Benzaldehyde-like with nut, coconut, cereal notes","['nutty', 'coconut']",1.0,1.0,1.0,1.0,0.0,1.0
1516,Methyl anthranilate,COC(=O)c1ccccc1N,1701,134-20-3,"Musty, neroli, grape-like odor; concord grape taste","['grape', 'musty']",1.0,1.0,0.0,1.0,1.0,1.0
2382,Tolyl isobutyrate,Cc1ccc(OC(=O)C(C)C)cc1,2689,103-93-5,"Strong, warm, animalic, lily-narcissus & fruity notes","['fruity', 'warm', 'animal']",1.0,1.0,1.0,1.0,0.0,1.0
211,Bisabolol,CC(C)=CCC[C@](C)(O)[C@@H]1CC=C(C)CC1,242,23089-26-1,"Mild floral note, contributes a lemon fruity character","['lemon', 'fruity', 'floral']",1.0,1.0,1.0,1.0,0.0,1.0
628,Dimethyloctanol,CCC(C)CCC(C)(O)CC,713,151-19-9,Sweet floral similar to tetrahydrolinalool,"['floral', 'sweet']",0.0,-1.0,-1.0,-1.0,-1.0,-1.0
410,Civetone,O=C1CCCCCCC/C=C\CCCCCCC1,471,542-46-1,"Sweet, animal, musky odor; sweet musky taste","['musk', 'sweet', 'animal']",1.0,1.0,1.0,0.0,1.0,1.0
2394,Tributylamine,CCCCN(CCCC)CCCC,2701,102-82-9,"Fishy, animalic, ripe cheese notes in dilution","['ripe', 'cheesy', 'fishy', 'animal']",1.0,1.0,1.0,1.0,0.0,1.0
2493,Xylenol,Cc1cc(C)cc(O)c1,2816,108-68-9,"Phenolic, spicy, woody-orris odor in dilution; balsamic taste at 1.5 ppm","['woody', 'phenolic', 'spicy', 'orris']",1.0,1.0,1.0,0.0,1.0,1.0
1482,Methoxycinnamaldehyde,COc1ccc(/C=C/C=O)cc1,1665,1963-36-6,"Warm, spicy (cinnamon), herbaceous odor; spicy taste","['cinnamon', 'spicy', 'warm', 'herbal']",1.0,1.0,1.0,0.0,1.0,1.0
883,Ethylmethylpyridine,CCc1ccc(C)nc1,983,104-90-5,"Fatty, green, nutty notes, earthy, raw potato","['potato', 'green', 'fatty', 'nutty', 'earthy']",1.0,0.0,1.0,1.0,1.0,1.0
3087,Dodecenoic acid,CCCCCCCCC/C=C/C(=O)O,3574,32466-54-9,"Mild fatty, slighly green fruity (see comments)","['green', 'fatty', 'fruity']",1.0,1.0,1.0,1.0,1.0,0.0
1605,Methyl propenyl disulfide,C/C=C/SSC,1797,5905-47-5,Pungent fresh leek-onion like,"['onion', 'fresh', 'pungent']",1.0,0.0,1.0,1.0,1.0,1.0
2233,Propyl isovalerate,CCCOC(=O)CC(C)C,2492,557-00-6,"Strong, fruity apple-like odor; apple-pineapple like taste","['fruity', 'apple']",1.0,1.0,1.0,1.0,1.0,0.0
906,Eugenyl benzoate,C=CCc1ccc(OC(=O)c2ccccc2)c(OC)c1,1009,531-26-0,"Mild balsamic, spicy odor; warm, clove-like undertones","['spicy', 'warm', 'balsamic']",1.0,0.0,1.0,1.0,1.0,1.0
1084,Hexenol,CC/C=C/CCO,1214,544-12-7,"Green, grass, leafy odor; bitter, grassy-fatty notes","['grassy', 'apple', 'green', 'fatty', 'fruity', 'herbal', 'leafy', 'vegetable']",1.0,1.0,1.0,1.0,0.0,1.0
1100,Hexenyl benzoate,CC/C=C\CCOC(=O)c1ccccc1,1231,25152-85-6,"Sweet, mild, green-herbaceous, woody balsamic odor","['green', 'herbal', 'woody', 'balsamic', 'sweet']",1.0,0.0,1.0,1.0,1.0,1.0
1109,Hexenyl heptanoate,CC/C=C/CCOC(=O)CCCCCC,1242,61444-39-1,"Green, fruity, somewhat waxy-fatty, tropical notes","['green', 'fruity', 'fatty', 'tropical', 'waxy']",0.0,-1.0,-1.0,-1.0,-1.0,-1.0
1559,Methyl isovalerate,COC(=O)CC(C)C,1747,556-24-1,"Strong, fruity, ethereal, pineapple-apple & juicy fruit odor and taste","['fruity', 'apple', 'pineapple', 'ethereal']",1.0,1.0,1.0,0.0,1.0,1.0
723,Fraistone,CCOC(=O)CC1(C)OCC(C)O1,814,6290-17-1,"Fresh, sweet-fruity notes reminiscent of apple and strawberry","['apple', 'fruity', 'fresh', 'strawberry', 'sweet']",1.0,1.0,1.0,1.0,0.0,1.0
2922,Hydroxybutyl methylbutyrate,CCC(C)C(=O)OCCCCO,3362,,Weak fruity,['fruity'],1.0,1.0,1.0,1.0,1.0,0.0
2706,Dodecanal dimethyl acetal,CCCCCCCCCCCC(OC)OC,3095,14620-52-1,"Mild, fatty, fresh-green, citrus, melon, apple notes","['apple', 'citrus', 'green', 'fatty', 'melon', 'fresh']",1.0,1.0,1.0,0.0,1.0,1.0
699,Dodecyl isobutyrate,CCCCCCCCCCCCOC(=O)C(C)C,789,6624-71-1,"Fatty-waxy, oily, milky & buttery","['oily', 'fatty', 'milky', 'waxy', 'buttery']",1.0,1.0,1.0,1.0,0.0,1.0
2197,Propanal methylbutyl propyl acetal,CCCOC(CC)OC(C)CCC,2455,238757-56-8,"Ethereal, green, alcoholic, cognac","['green', 'cognac', 'alcoholic', 'ethereal']",1.0,1.0,1.0,1.0,0.0,1.0
345,Carvyl acetate,C=C(C)C1CC=C(C)C(OC(C)=O)C1,402,97-42-7,"Green, herbal, sweet, sour-fruity, spearmint-like odor; spicy-mint taste","['sour', 'green', 'fruity', 'herbal', 'sweet']",1.0,1.0,1.0,0.0,1.0,1.0
2856,Ethyl nonenoate,CCCCCCC=CC(=O)OCC,3285,,"Green, pear notes, fatty","['green', 'fatty', 'pear']",1.0,1.0,0.0,1.0,1.0,1.0
2820,Decyl octanoate,CCCCCCCCCCOC(=O)CCCCCCC,3237,2306-89-0,"Oily-fruity, also floral, citrusy and winey","['citrus', 'oily', 'fruity', 'winey', 'floral']",1.0,1.0,0.0,1.0,1.0,1.0
2391,Tolylbutanone,CC(=O)CCc1ccc(C)cc1,2698,7774-79-0,"Sweet, fruity, floral odor; sweet, fruity taste","['fruity', 'floral', 'sweet']",1.0,1.0,1.0,1.0,0.0,1.0
2274,Quinoxaline,c1ccc2nccnc2c1,2545,91-19-0,Burnt toasted notes,['burnt'],1.0,1.0,1.0,0.0,1.0,1.0
2268,Pyridinemethanethiol,SCc1ccccn1,2530,2044-73-7,"Meaty, roasted, savory, fatty, pork, sulfurous odor & taste","['roasted', 'meaty', 'fatty', 'savory', 'sulfurous']",1.0,1.0,0.0,1.0,1.0,1.0
2466,Valerolactone,CC1CCC(=O)O1,2783,108-29-2,"Sweet, hay-like, coumarinic odor and coconut taste","['coumarinic', 'hay', 'sweet']",1.0,1.0,0.0,1.0,1.0,1.0
2142,Phenylpropionaldehyde,O=CCCc1ccccc1,2391,104-53-0,"Green, floral (hyacinth), balsamic odor; green, fruity-melon, citrus taste","['green', 'balsamic', 'floral']",1.0,1.0,1.0,0.0,1.0,1.0
1342,Isopropyl isobutyrate,CC(C)OC(=O)C(C)C,1494,617-50-5,Fresh fruity pineapple-pear odor; pineapple-citrus taste,"['fruity', 'fresh', 'pineapple', 'pear']",1.0,1.0,1.0,0.0,1.0,1.0
611,Dimethylheptanol,CC(C)CCCC(C)(C)O,694,13254-34-7,"Fresh, floral, lavender, muguet with citrus nuances","['citrus', 'fresh', 'floral']",1.0,1.0,0.0,1.0,1.0,1.0
193,Benzyl lactate,CC(O)C(=O)OCc1ccccc1,224,2051-96-9,"Bland weak sweet, caramellic, dairy fruity note","['caramellic', 'fruity', 'dairy', 'sweet']",1.0,1.0,1.0,1.0,1.0,0.0
792,Ethyl methyldithiopropionate,CCOC(=O)C(C)SSC,887,23747-43-5,"Sulfurous, green, onion; fruity (tropical-pineapple) in extreme dilution","['green', 'fruity', 'tropical', 'onion', 'sulfurous', 'pineapple']",0.0,-1.0,-1.0,-1.0,-1.0,-1.0
473,Decenolactone,C/C=C/CCC1CCCC(=O)O1,541,32764-98-0,"Oily, fruity, floral (petal-like) with apricot-peach notes","['apricot', 'oily', 'fruity', 'peach', 'floral']",1.0,1.0,1.0,0.0,1.0,1.0
3355,Isobutyl methyl disulfide,CSSCC(C)C,3972,67421-83-4,"Sulfurous; allium, savory, meaty, green, vegetative","['vegetable', 'meaty', 'green', 'alliaceous', 'savory', 'sulfurous']",1.0,1.0,1.0,1.0,0.0,1.0
3378,Nonenolide,O=C1C=CCCCCCCO1,4000,51352-68-2,"Coconut, coumarinic, tobacco, somewhat fruity","['tobacco', 'fruity', 'coconut', 'coumarinic']",0.0,-1.0,-1.0,-1.0,-1.0,-1.0
2639,Butyl isothiocyanate,CCC(C)N=C=S,3019,4426-79-3,"Chemical, very mildly pungent, horseradish","['pungent', 'horseradish']",1.0,1.0,0.0,1.0,1.0,1.0
45,Acetyl thymol,CC(=O)Oc1cc(C)ccc1C(C)C,50,528-79-0,"Spicy-herbaceous, thyme, balsamic, smoky; pungent spicy taste","['spicy', 'smoky', 'herbal', 'balsamic']",0.0,-1.0,-1.0,-1.0,-1.0,-1.0
967,Geranyl isobutyrate,CC(C)=CCC/C(C)=C/COC(=O)C(C)C,1077,2345-26-8,"Sweet, heavy fruity rosy odor and a sweet apricot-like taste","['fruity', 'rose', 'sweet']",0.0,-1.0,-1.0,-1.0,-1.0,-1.0
87,Allyl cyclohexanevalerate,C=CCOC(=O)CCCCC1CCCCC1,105,7493-68-7,"Sweet, mixed-fruity odor; waxy pineapple-apricot-apple taste","['fruity', 'sweet']",1.0,1.0,1.0,0.0,1.0,1.0
1744,Methylionone,CCC(=O)/C=C/C1=C(C)CCCC1(C)C,1945,127-43-5,"Woody, beta-ionone like; berry-like taste",['woody'],1.0,1.0,1.0,0.0,1.0,1.0
2203,Isopropenyl acetate,C=C(C)OC(C)=O,2461,108-22-5,"Ethereal, fruity, rum, cognac - ethyl acetate like","['ethereal', 'fruity', 'cognac', 'rum']",1.0,1.0,1.0,0.0,1.0,1.0
3223,Ethyl linalyl acetate,C=CC(C)(CC/C=C(\C)CC)OC(C)=O,3749,61931-80-4,"Fresh, Floral, Bergamot, Fruity, Pear-Like","['fruity', 'pear', 'fresh', 'floral']",1.0,1.0,1.0,1.0,0.0,1.0
2527,Hexenol,C/C=C\CCCO,2859,928-91-6,"Green, fruity, vegetable, slight tomato","['green', 'fruity', 'vegetable', 'tomato']",0.0,-1.0,-1.0,-1.0,-1.0,-1.0
2464,Valeraldehyde,CCCCC=O,2781,110-62-3,"Strong, acrid, pungent odor; chocolate & nut-like below 10ppm","['nutty', 'pungent', 'chocolate']",1.0,1.0,0.0,1.0,1.0,1.0
1344,Isopropyl levulinate,CC(=O)CCC(=O)OC(C)C,1496,21884-26-4,"Sweet, fruity, boiled red beans, melon and banana","['fruity', 'banana', 'melon', 'sweet']",1.0,1.0,1.0,1.0,0.0,1.0
2358,Theobromine,Cn1cnc2c1c(=O)[nH]c(=O)n2C,2661,83-67-0,Odorless with bitter taste,['odorless'],1.0,1.0,1.0,0.0,1.0,1.0
1403,Linalool oxide,CC(C)=CCCC(C)(O)C1CO1,1561,1365-19-1,"Strong, sweet, woody, floral, creamy with a slight minty note","['creamy', 'fresh', 'woody', 'floral', 'sweet', 'mint']",0.0,-1.0,-1.0,-1.0,-1.0,-1.0
1081,Hexenal,CCC/C=C\C=O,1207,16635-54-4,"Fresh, strong, green grass & green-fruity","['green', 'fruity', 'fresh', 'grassy']",1.0,1.0,1.0,1.0,0.0,1.0
3447,Isopropylideneglyceryl hydroxydecanoate,CCCCCCCCC(O)C(=O)OC(=C(C)C)C(O)CO,4147,172201-58-0,Sweet fatty peach-like; Precusor of delta-decalactone,"['fatty', 'peach', 'sweet']",1.0,0.0,1.0,1.0,1.0,1.0
1228,Isoamyl isovalerate,CC(C)CCOC(=O)CC(C)C,1371,659-70-1,"Fruity odor of green-apple, pineapple, tropical, mango, apricot. cognac","['apple', 'apricot', 'green', 'fruity', 'tropical', 'cognac', 'pineapple']",1.0,1.0,0.0,1.0,1.0,1.0
1505,Methoxyvinylphenol,C=Cc1ccc(O)c(OC)c1,1689,7786-61-0,"Sweet, spicy, clove-like, somewhat smoky odor; sweet taste","['spicy', 'sweet', 'smoky']",0.0,-1.0,-1.0,-1.0,-1.0,-1.0
228,Butanal ethyl amyl acetal,CCCCCOC(CCC)OCC,260,3658-92-2,"Ethereal, green, cognac, alcoholic, fermented","['alcoholic', 'ethereal', 'green', 'fermented', 'cognac']",1.0,1.0,1.0,1.0,1.0,0.0
2253,Propylphenethyl alcohol,CCCC(O)Cc1ccccc1,2514,705-73-7,"Green, sweet earthy odor; sweet, green fruity taste","['green', 'earthy', 'sweet']",1.0,0.0,1.0,1.0,1.0,1.0
2962,Methyl ethylbutyrate,CCC(CC)C(=O)OC,3406,816-11-5,"Fruity, apple, caprylic","['fruity', 'apple']",1.0,0.0,1.0,1.0,1.0,1.0
3286,Undecenone,C=CCCCCCCCC(C)=O,3874,36219-73-5,"Green fruity-fleshy, citrus, tropical, mango, melon","['citrus', 'green', 'fruity', 'melon', 'tropical']",1.0,1.0,1.0,1.0,0.0,1.0
1560,Methyl jasmonate,CC/C=C/CC1C(=O)CCC1CC(=O)OC,1748,39924-52-2,"Strong, floral-jasmine odor; sweet, floral, fruity taste","['floral', 'jasmine']",1.0,0.0,1.0,1.0,1.0,1.0
1998,Octenol,CCCC/C=C/C(C)O,2232,76649-14-4,"Mushroom, watermelon, green melon rind, earthy and nutty notes","['green', 'earthy', 'nutty', 'melon', 'mushroom']",1.0,1.0,1.0,1.0,0.0,1.0
1584,Methyl naphthyl ketone,CC(=O)c1cccc2ccccc12,1774,941-98-0,Harsh orange blossom odor,['orange'],1.0,1.0,1.0,0.0,1.0,1.0
2210,Propionylmenthene,CCC(=O)C1CC(C(C)C)CC=C1C,2468,31375-17-4,"Citrus, Green, Leafy, Natural, Agrestic","['citrus', 'green', 'leafy']",0.0,-1.0,-1.0,-1.0,-1.0,-1.0
2924,Hydroxybenzyl acetate,CC(=O)OC(O)c1ccccc1,3364,,Mild green floral with phenolic notes,"['green', 'phenolic', 'floral']",1.0,1.0,1.0,1.0,0.0,1.0
2756,Undecanal dimethyl acetal,CCCCCCCCCCC(OC)OC,3164,52517-67-6,"Soft, oily-citrusy odor","['oily', 'citrus']",1.0,0.0,1.0,1.0,1.0,1.0
985,Glyceryl monooleate,CCCCCCCC/C=C\CCCCCCCC(=O)OCC(O)CO,1098,25496-72-4,"Faint, sweet, oily odor; weak fatty, oily taste","['oily', 'sweet']",0.0,-1.0,-1.0,-1.0,-1.0,-1.0
1069,Hexanethiol,CCCCCCS,1195,111-31-9,"Sulfurous, roasted meat, savory, burnt, fatty, coffee nuances","['roasted', 'meaty', 'fatty', 'savory', 'burnt', 'coffee', 'sulfurous']",1.0,1.0,1.0,1.0,1.0,0.0
1755,Methylnaphthalene,Cc1cccc2ccccc12,1958,90-12-0,"Green, musty taste, earthy, medicinal","['green', 'earthy', 'medicinal', 'musty']",0.0,-1.0,-1.0,-1.0,-1.0,-1.0
2154,Phenylpropyl isovalerate,CC(C)CC(=O)OCCCc1ccccc1,2403,5452-07-3,"Fruity (strawberry-prune) odor; sweet ""preserve"" like taste","['fruity', 'strawberry']",1.0,1.0,1.0,1.0,0.0,1.0
1498,Anisyl acetone,COc1ccc(CCC(C)=O)cc1,1682,104-20-1,"Sweet, floral, fruity-berry odor; sweet berry-cherry fruity taste","['fruity', 'floral', 'sweet', 'berry']",1.0,1.0,1.0,1.0,0.0,1.0
2502,Ethyl heptenoate,CC/C=C/CCC(=O)OCC,2826,39924-27-1,"Fruity, waxy-green, melon odor; waxy-green-tropical taste; also vegetative","['green', 'fruity', 'melon', 'waxy', 'vegetable']",1.0,0.0,1.0,1.0,1.0,1.0
2533,Piperitone,CC1=CC(=O)C(C(C)C)CC1,2870,89-81-6,"Fresh strong herbaceous, minty","['fresh', 'mint', 'herbal']",1.0,1.0,1.0,1.0,0.0,1.0
1211,Ionyl acetate,CC(=O)OC(C)/C=C/C1=C(C)CCCC1(C)C,1354,22030-19-9,"Natural fruity, raspberry-like with woody note","['woody', 'fruity']",1.0,1.0,0.0,1.0,1.0,1.0
2440,Undecadienal,CCCCCC/C=C/C=C/C=O,2754,13162-46-4,"Oily, buttery, fatty, green, baked chicken notes in dilution","['green', 'oily', 'fatty', 'chicken', 'buttery']",1.0,1.0,1.0,1.0,1.0,0.0
160,Artemisia Ketone,C=CC(C)(C)C(=O)C=C(C)C,189,546-49-6,"Green herbaceous artemisia odor, with some honey, mint & berry like notes","['green', 'honey', 'berry', 'herbal', 'mint']",0.0,-1.0,-1.0,-1.0,-1.0,-1.0
266,Butyl ethyl malonate,CCCCOC(=O)CC(=O)OCC,302,17373-84-1,"Oily, green-winey, apple odor and fruity herbal-green, slight woody taste","['green', 'oily', 'apple', 'winey']",1.0,1.0,1.0,1.0,0.0,1.0
3196,Methyl isothiocyanate,CN=C=S,3710,556-61-6,"Pungent, mustard, horseradish-like","['pungent', 'horseradish']",1.0,1.0,1.0,1.0,0.0,1.0
3094,Methylnonanoic acid,CC(C)CCCCCCC(=O)O,3583,5963-14-4,"Mild mutton like fatty odor; soapy, decanoic acid like taste",['fatty'],1.0,1.0,1.0,0.0,1.0,1.0
3441,Ethyl ethylthiobutyrate,CCOC(=O)CC(C)SCC,4124,90201-28-8,"Sulfurous, tropical overripe fruity","['sulfurous', 'fruity', 'tropical']",1.0,1.0,0.0,1.0,1.0,1.0
264,Butyl decenoate,CCCCCCC/C=C/C(=O)OCCCC,300,7492-45-7,"Rich, green-waxy, fruity-milky-coconut-peach-apricot notes","['apricot', 'green', 'fruity', 'milky', 'coconut', 'waxy', 'peach']",0.0,-1.0,-1.0,-1.0,-1.0,-1.0
2032,Palmityl acetate,CCCCCCCCCCCCCCCCOC(C)=O,2277,629-70-9,"Weak, mild sweet waxy","['waxy', 'sweet']",1.0,1.0,1.0,1.0,1.0,0.0
996,Heptadecanone,CCCCCCCCCCCCCCCC(C)=O,1115,2922-51-2,Mild fatty dairy note,"['fatty', 'dairy']",0.0,-1.0,-1.0,-1.0,-1.0,-1.0
1436,Menthenyl acetate,CC(=O)OC1C=C(C)CCC1C(C)C,1606,28839-13-6,"Sweet, fruity, herbaceous spicy odor","['fruity', 'spicy', 'sweet', 'herbal']",1.0,1.0,0.0,1.0,1.0,1.0
1016,Heptenal,CCCC/C=C/C=O,1137,2463-63-0,"Pungent, green-fatty-vegetable; In dilution vegetable, green","['apple', 'green', 'fatty', 'fruity', 'fresh', 'vegetable', 'pungent', 'sweet']",1.0,1.0,1.0,1.0,1.0,0.0
3245,Decyl isohexanoate,CCCCCCCCCCOC(=O)CCC(C)C,3796,,"Oily, fruity","['oily', 'fruity']",0.0,-1.0,-1.0,-1.0,-1.0,-1.0
848,Ethylbenzaldehyde,CCc1ccccc1C=O,945,22927-13-5,Spicy; somewhat bitter almond notes,"['spicy', 'almond']",1.0,0.0,1.0,1.0,1.0,1.0
1698,Methyldimethoxyphenol,COc1cc(C)cc(OC)c1O,1894,6638-05-7,"Smoky, spicy, phenolic, medicinal,","['medicinal', 'phenolic', 'smoky', 'spicy']",1.0,1.0,1.0,1.0,1.0,0.0
1862,Methylthiopropionic acid,CSC(C)C(=O)O,2077,58809-73-7,Strong sulfurous; green tropical fruit & cheese note in dilution,"['green', 'fruity', 'tropical', 'sulfurous', 'cheesy']",1.0,1.0,1.0,0.0,1.0,1.0
3460,Hexylcyclopentenone,CCCCCCC1=CCCC1=O,4164,95-41-0,Very sweet jasmin-hay odor with fruity herbal notes,"['hay', 'fruity', 'jasmine', 'herbal', 'sweet']",1.0,0.0,1.0,1.0,1.0,1.0
892,Ethylphenol,CCc1ccc(O)cc1,992,123-07-9,"Strong, woody-phenolic, animallic odor, phenolic, smoky flavor","['woody', 'phenolic', 'animal']",1.0,1.0,1.0,1.0,1.0,0.0
